id,short_id,title,message,additions,deletions,total,author_name,author_email,committer_name,committer_email,authored_date,committed_date,parent_ids
aefd290574c2bcfd9b57b11bd79e14bf2bf3c39d,aefd2905,Adding privacy agreement.,Adding privacy agreement.,,,,videogameboy76,videogameboy76@yahoo.com,videogameboy76,videogameboy76@yahoo.com,1486481336,1486481336,4c8a8e53789fa0b2981f9d2d5e009fc23c3e9c73
4c8a8e53789fa0b2981f9d2d5e009fc23c3e9c73,4c8a8e53,Fixed some stuff.,Fixed some stuff.,,,,videogameboy76,videogameboy76@yahoo.com,videogameboy76,videogameboy76@yahoo.com,1464631070,1464631070,1acbb5209b14dbb554fc152057fcae8acc0f3a2b
1acbb5209b14dbb554fc152057fcae8acc0f3a2b,1acbb520,Updated mySQL database and website.,Updated mySQL database and website.,,,,videogameboy76,videogameboy76@yahoo.com,videogameboy76,videogameboy76@yahoo.com,1463707344,1463707344,da87c7780f269c0771947d104d9bcf9407220034
da87c7780f269c0771947d104d9bcf9407220034,da87c778,Resized arrows so they showed up better on different displays.,Resized arrows so they showed up better on different displays.,,,,videogameboy76,videogameboy76@yahoo.com,videogameboy76,videogameboy76@yahoo.com,1462545889,1462545889,6445a80092312595fd3e9906b75720fd6271694d
6445a80092312595fd3e9906b75720fd6271694d,6445a800,Replaced all bubble graphics with colorblind friendly versions.,Replaced all bubble graphics with colorblind friendly versions.,,,,videogameboy76,videogameboy76@yahoo.com,videogameboy76,videogameboy76@yahoo.com,1462541101,1462541101,2ba62f03876ec9d312857e6ac1f8b17fc7e2756c
2ba62f03876ec9d312857e6ac1f8b17fc7e2756c,2ba62f03,Removing redundant display related resources.,Removing redundant display related resources.,,,,videogameboy76,videogameboy76@yahoo.com,videogameboy76,videogameboy76@yahoo.com,1462538641,1462538641,878e6a5003784a619cd33e543f9ab19b6dbe76d4
878e6a5003784a619cd33e543f9ab19b6dbe76d4,878e6a50,Fixed invisible bubble graphic for different displays.,Fixed invisible bubble graphic for different displays.,,,,videogameboy76,videogameboy76@yahoo.com,videogameboy76,videogameboy76@yahoo.com,1462538512,1462538512,9928bbb54ce2939c11ebc882e10b7cc8b925e62b
9928bbb54ce2939c11ebc882e10b7cc8b925e62b,9928bbb5,Removing redundant resources.,Removing redundant resources.,,,,videogameboy76,videogameboy76@yahoo.com,videogameboy76,videogameboy76@yahoo.com,1462537845,1462537845,3ad4d5fc5db03cdabbadddbe01a65d4a154fd898
3ad4d5fc5db03cdabbadddbe01a65d4a154fd898,3ad4d5fc,Removing redundant resources.,Removing redundant resources.,,,,videogameboy76,videogameboy76@yahoo.com,videogameboy76,videogameboy76@yahoo.com,1462537829,1462537829,f7fdec5026b0c59fbff5b4eb14fb85b8c7eb33a0
f7fdec5026b0c59fbff5b4eb14fb85b8c7eb33a0,f7fdec50,Updated.,Updated.,,,,videogameboy76,videogameboy76@yahoo.com,videogameboy76,videogameboy76@yahoo.com,1462537755,1462537755,a94a870d1991f300d34a2f60562921ada3a8b3a1
a94a870d1991f300d34a2f60562921ada3a8b3a1,a94a870d,Sharpened images.,Sharpened images.,,,,videogameboy76,videogameboy76@yahoo.com,videogameboy76,videogameboy76@yahoo.com,1462497940,1462497940,e47d8162708642b5fd6e907e8c2e90454bd63b36
e47d8162708642b5fd6e907e8c2e90454bd63b36,e47d8162,Resized high resolution graphics for optimal display.,Resized high resolution graphics for optimal display.,,,,videogameboy76,videogameboy76@yahoo.com,videogameboy76,videogameboy76@yahoo.com,1462483151,1462483151,0b6c6609db2b6e8eab719468db6c09caa8c3d500
0b6c6609db2b6e8eab719468db6c09caa8c3d500,0b6c6609,Removing erroneous low resolution screen resources.,Removing erroneous low resolution screen resources.,,,,videogameboy76,videogameboy76@yahoo.com,videogameboy76,videogameboy76@yahoo.com,1462478515,1462478515,23a0fc3f9642b4011d88cf733eeab8541d84d346
23a0fc3f9642b4011d88cf733eeab8541d84d346,23a0fc3f,Removing erroneous low resolution screen resources.,Removing erroneous low resolution screen resources.,,,,videogameboy76,videogameboy76@yahoo.com,videogameboy76,videogameboy76@yahoo.com,1462478503,1462478503,93fc40d9fbae05384894342fa6fa532cd23b98fc
93fc40d9fbae05384894342fa6fa532cd23b98fc,93fc40d9,Removing erroneous low resolution screen resources.,Removing erroneous low resolution screen resources.,,,,videogameboy76,videogameboy76@yahoo.com,videogameboy76,videogameboy76@yahoo.com,1462478488,1462478488,6905cca98fe08299bfa6486d81a0cafd52e8640d
6905cca98fe08299bfa6486d81a0cafd52e8640d,6905cca9,Adding high screen density images.,Adding high screen density images.,,,,videogameboy76,videogameboy76@yahoo.com,videogameboy76,videogameboy76@yahoo.com,1462478410,1462478410,2af9718fc54bd070982a8d64fb79c85c7eb0f314
2af9718fc54bd070982a8d64fb79c85c7eb0f314,2af9718f,Removing to improve different display size support.,Removing to improve different display size support.,,,,videogameboy76,videogameboy76@yahoo.com,videogameboy76,videogameboy76@yahoo.com,1462478119,1462478119,6ae0047a0cb6189af2bb3c85c357f1c88520ac3f
6ae0047a0cb6189af2bb3c85c357f1c88520ac3f,6ae0047a,Removing to improve different display size support.,Removing to improve different display size support.,,,,videogameboy76,videogameboy76@yahoo.com,videogameboy76,videogameboy76@yahoo.com,1462476908,1462476908,45bc9df48602da8fbe53e55b61457196bc416f78
45bc9df48602da8fbe53e55b61457196bc416f78,45bc9df4,Removing to improve different display size support.,Removing to improve different display size support.,,,,videogameboy76,videogameboy76@yahoo.com,videogameboy76,videogameboy76@yahoo.com,1462475501,1462475501,75e00d3cf9f5cdd184d2833038141b54ea2384ee
75e00d3cf9f5cdd184d2833038141b54ea2384ee,75e00d3c,Adding proper normal (mdpi) and large (ldpi) display support.,Adding proper normal (mdpi) and large (ldpi) display support.,,,,videogameboy76,videogameboy76@yahoo.com,videogameboy76,videogameboy76@yahoo.com,1462475371,1462475371,adaa72ec4753aa75304dfce1441d97365d3e90a6
adaa72ec4753aa75304dfce1441d97365d3e90a6,adaa72ec,Provide a unique identifier for each application installation for the purpose of…,Provide a unique identifier for each application installation for the purpose of preventing users from overwriting each others' level packs.,,,,videogameboy76,videogameboy76@yahoo.com,videogameboy76,videogameboy76@yahoo.com,1462385716,1462385716,24caa6a1e0ccb41f8d804e7700966990673a991a
24caa6a1e0ccb41f8d804e7700966990673a991a,24caa6a1,Removing stub class.,Removing stub class.,,,,videogameboy76,videogameboy76@yahoo.com,videogameboy76,videogameboy76@yahoo.com,1462383823,1462383823,61f8abd6e5fe310febe636ca466d159388c25318
61f8abd6e5fe310febe636ca466d159388c25318,61f8abd6,Added release info.,Added release info.,,,,videogameboy76,videogameboy76@yahoo.com,videogameboy76,videogameboy76@yahoo.com,1462305143,1462305143,796a90fa401af3d40deff4470650736bd9ffdb3f
796a90fa401af3d40deff4470650736bd9ffdb3f,796a90fa,Updated version to reflect changes for open source application conversion.,Updated version to reflect changes for open source application conversion.,,,,videogameboy76,videogameboy76@yahoo.com,videogameboy76,videogameboy76@yahoo.com,1462300931,1462300931,cddfd69ce6c090ff6926466c527a47f27f4a4a5c
cddfd69ce6c090ff6926466c527a47f27f4a4a5c,cddfd69c,Added GNU license header to all source files.,Added GNU license header to all source files.,,,,videogameboy76,videogameboy76@yahoo.com,videogameboy76,videogameboy76@yahoo.com,1462298550,1462298550,9ee30c41290178250ae40aca251638f406f99af9
9ee30c41290178250ae40aca251638f406f99af9,9ee30c41,Initial import.,Initial import.,,,,videogameboy76,videogameboy76@yahoo.com,videogameboy76,videogameboy76@yahoo.com,1462295582,1462295582,43f5733c72ad7893b552454497c7169d92b27c30
43f5733c72ad7893b552454497c7169d92b27c30,43f5733c,Initial commit,Initial commit,,,,videogameboy76,videogameboy76@yahoo.com,videogameboy76,videogameboy76@yahoo.com,1462294949,1462294949,
