commit_hash,tag_name,tag_message
2ad537df9ad95bf953c8c04c046e8d320f7d5639,v1.7.1,db updated; navigation fixed
d89ce62c15f74a258c2286faa4c4d1be55815851,v1.7.0,"upgraded db with all headers and subheaders, added DaoGenerator Project"
9576f6b8794dbc5a35cc4845a2999cdbe50f2e02,v1.6.0,settings to change theme color
5c7d6a9d289930ef851a5a212fe01aec254db039,v1.5.2,fixed bug on sharing/copying
4254ecd777c89d18d0be71341763119b6112787a,v1.5.1,headers for Exodus book
046599c5934d16d966b013ab960abd34d81301f5,v1.5.0,headers on Genesis book
c0e825ad0d6b99bce8fada3b6e99b072c3ad2903,v1.4.0,v1.4.0
babc073743d0fb9867ce026e92c3fa442b4b63ae,v1.0,Biblia ARC - CCB básica
