id,short_id,title,message,additions,deletions,total,author_name,author_email,committer_name,committer_email,authored_date,committed_date,parent_ids
161f1795709389cae1033717c1804d1fdf72e7d7,161f1795,home action item and the discard dialog is added,"home action item and the discard dialog is added
",,,,baba saikiran,saikiranenjoys@gmail.com,baba saikiran,saikiranenjoys@gmail.com,1343114880,1343121071,5d77fd293f18d28653a05718ba3d9ff29f796475
5d77fd293f18d28653a05718ba3d9ff29f796475,5d77fd29,removed unused imports and code,"removed unused imports and code
",,,,baba saikiran,saikiranenjoys@gmail.com,baba saikiran,saikiranenjoys@gmail.com,1343114797,1343121022,09302909023b3b99c64ab6b993bce2d4031cc553
09302909023b3b99c64ab6b993bce2d4031cc553,09302909,images resolution modified to support the mdpi devices,"images resolution modified to support the mdpi devices
",,,,baba saikiran,saikiranenjoys@gmail.com,baba saikiran,saikiranenjoys@gmail.com,1343114399,1343114399,cb839db5d4405599662799b58fa620d38183ddde
cb839db5d4405599662799b58fa620d38183ddde,cb839db5,Added discard confirmation dialog for edit/new module.,"Added discard confirmation dialog for edit/new module.
	-editmoduledetailFragment is shown same as new module item as a new activity
	-supported string are added for the confiramtion dialog.
",,,,baba saikiran,saikiranenjoys@gmail.com,baba saikiran,saikiranenjoys@gmail.com,1341999424,1341999424,70b58b2a168ca1c7e8a2b3fd3e7a1a5d2d8c4f1a
70b58b2a168ca1c7e8a2b3fd3e7a1a5d2d8c4f1a,70b58b2a,home action bar item added to SearchActivity,"home action bar item added to SearchActivity

	-condition check added to insert record in offline mode
",,,,baba saikiran,saikiranenjoys@gmail.com,baba saikiran,saikiranenjoys@gmail.com,1340773972,1341231816,7d8fb8d4611a0f27b8a339db21b9b81d1cf33b92
7d8fb8d4611a0f27b8a339db21b9b81d1cf33b92,7d8fb8d4,hardcoded string moved to the string resource,"hardcoded string moved to the string resource

	-added sleep to async task to complete the metadata sync
",,,,baba saikiran,saikiranenjoys@gmail.com,baba saikiran,saikiranenjoys@gmail.com,1340627127,1341231816,0809c5bedbfa2d46863e6c182a514d4e3599094d
0809c5bedbfa2d46863e6c182a514d4e3599094d,0809c5be,sort selection is saved in all modules,"sort selection is saved in all modules

	-changed the ModuleSortConfigActivity to display sort settings
",,,,baba saikiran,saikiranenjoys@gmail.com,baba saikiran,saikiranenjoys@gmail.com,1340108793,1341231796,1f5f38f0c46990a65dc9b2f9667cfcd3e78b24a0
1f5f38f0c46990a65dc9b2f9667cfcd3e78b24a0,1f5f38f0,Added seamless_login rest method,"Added seamless_login rest method

	-method is used to validate the sessionid
	-code added to get new sessionid if it is expired
",,,,baba saikiran,saikiranenjoys@gmail.com,baba saikiran,saikiranenjoys@gmail.com,1339677340,1340185922,2103a1375a21e49e30f35166fe5dbebaef18a646
2103a1375a21e49e30f35166fe5dbebaef18a646,2103a137,Added onresume method to reflect the saved changes,"Added onresume method to reflect the saved changes
",,,,baba saikiran,saikiranenjoys@gmail.com,baba saikiran,saikiranenjoys@gmail.com,1339491420,1339505051,6c00f606edca69708d422809119d5de60727460e
6c00f606edca69708d422809119d5de60727460e,6c00f606,Toast message added to notify the user if n/w is not avilable while syncing modules,"Toast message added to notify the user if n/w is not avilable while syncing modules
",,,,baba saikiran,saikiranenjoys@gmail.com,baba saikiran,saikiranenjoys@gmail.com,1339491299,1339491299,6c8de0227358c5cce70e1c5e80be00ffa9633a21
6c8de0227358c5cce70e1c5e80be00ffa9633a21,6c8de022,BeanID is added to the intent to properly launch the detail activity,"BeanID is added to the intent to properly launch the detail activity
",,,,baba saikiran,saikiranenjoys@gmail.com,baba saikiran,saikiranenjoys@gmail.com,1339491220,1339491220,7acc0a58d3c1fd9f48096d35c614a89cc4494bf5
7acc0a58d3c1fd9f48096d35c614a89cc4494bf5,7acc0a58,handled the clearing of app data by launching the authentication activity,"handled the clearing of app data by launching the authentication activity
",,,,baba saikiran,saikiranenjoys@gmail.com,baba saikiran,saikiranenjoys@gmail.com,1339491012,1339491012,2eda97662c17d30ef52786f6420ebd8f807e3b58
2eda97662c17d30ef52786f6420ebd8f807e3b58,2eda9766,removed  the textview showing the account name and account name is displayed on actionbar,"removed  the textview showing the account name and account name is displayed on actionbar
",,,,baba saikiran,saikiranenjoys@gmail.com,baba saikiran,saikiranenjoys@gmail.com,1339489846,1339489846,8dc497145901ab65a124f2012e085aedea878937
8dc497145901ab65a124f2012e085aedea878937,8dc49714,formatted the code using eclipse_formatter.xml and sugarcrm.importorder,"formatted the code using eclipse_formatter.xml and sugarcrm.importorder
",,,,baba saikiran,saikiranenjoys@gmail.com,Tapasya K H S,tapasyakhs@gmail.com,1339071484,1339073501,652484a06ef08fbc818249a4fad357338330fcb9
652484a06ef08fbc818249a4fad357338330fcb9,652484a0,replaced hardcoded string with constant,"replaced hardcoded string with constant
",,,,baba saikiran,saikiranenjoys@gmail.com,Tapasya K H S,tapasyakhs@gmail.com,1339071156,1339073467,315798da542415d980e9d05b12f768e7108f1ddd
315798da542415d980e9d05b12f768e7108f1ddd,315798da,added an info dialog to notify sync progress,"added an info dialog to notify sync progress
",,,,baba saikiran,saikiranenjoys@gmail.com,Tapasya K H S,tapasyakhs@gmail.com,1339071069,1339073467,724c84be6b04a58c6eda5fef41b6eb673a7b9306
724c84be6b04a58c6eda5fef41b6eb673a7b9306,724c84be,modifed the background image texture,"modifed the background image texture
",,,,baba saikiran,saikiranenjoys@gmail.com,Tapasya K H S,tapasyakhs@gmail.com,1339070868,1339073467,5484fe23a4454dfa4a122c672e0416b6f9058991
5484fe23a4454dfa4a122c672e0416b6f9058991,5484fe23,background texture is applied for all the screens(activites/fragments),"background texture is applied for all the screens(activites/fragments)
",,,,baba saikiran,saikiranenjoys@gmail.com,Tapasya K H S,tapasyakhs@gmail.com,1338551090,1339073467,c74f36a9bd4bfbb5cbfb27254d242cd3685a39e1
c74f36a9bd4bfbb5cbfb27254d242cd3685a39e1,c74f36a9,JSON Exception handled for the Leads module while sync in progress,"JSON Exception handled for the Leads module while sync in progress
",,,,baba saikiran,saikiranenjoys@gmail.com,Tapasya K H S,tapasyakhs@gmail.com,1338550475,1339073467,108cbc4efd9b49ba599ead6874558af9ab28f453
108cbc4efd9b49ba599ead6874558af9ab28f453,108cbc4e,Added flag to handle Expect: 100-Continue header while syncing,"Added flag to handle Expect: 100-Continue header while syncing
",,,,baba saikiran,saikiranenjoys@gmail.com,Tapasya K H S,tapasyakhs@gmail.com,1338550278,1339073467,f7df69697e65dd16117c47026d284ba36545563f
f7df69697e65dd16117c47026d284ba36545563f,f7df6969,showing status bar notification while syncing,"showing status bar notification while syncing

	-notification added to show the sync status
	-required string added to strings.xml
",,,,baba saikiran,saikiranenjoys@gmail.com,Tapasya K H S,tapasyakhs@gmail.com,1338550137,1339073467,aa15c122039d8da898d7cb505cef6fce670393a8
aa15c122039d8da898d7cb505cef6fce670393a8,aa15c122,Added confirmation alert dialog for delete action,"Added confirmation alert dialog for delete action

	Fixed the typo error
	clean up some commented code
",,,,baba saikiran,saikiranenjoys@gmail.com,Tapasya K H S,tapasyakhs@gmail.com,1337862461,1339073467,a3dfda37aa7bea102e5f63e9f10d156d0c26bae0
a3dfda37aa7bea102e5f63e9f10d156d0c26bae0,a3dfda37,modified images for actionbar and added folder drawable-large-v11 for tablet support,"modified images for actionbar and added folder drawable-large-v11 for tablet support

	styles added to support the large screen devices
	removed hardcoded values to dimens.xml and integer.xml
	categorised values based on scree sizes
",,,,baba saikiran,saikiranenjoys@gmail.com,Tapasya K H S,tapasyakhs@gmail.com,1337780364,1339073467,dc044d422b0b6795f51f5af92946d7b24bf31db3
dc044d422b0b6795f51f5af92946d7b24bf31db3,dc044d42,hardcoded string replaced with string identifiers,"hardcoded string replaced with string identifiers

	notify method removed and using the old existing methods
	code formatted as per guidelines
	hardcoded string(s) added to strings.xml
",,,,baba saikiran,saikiranenjoys@gmail.com,Tapasya K H S,tapasyakhs@gmail.com,1337779518,1339073441,8f39362dc7d366d691bd076e7606322164ba61a2
8f39362dc7d366d691bd076e7606322164ba61a2,8f39362d,implemented actionbar pattern across application,"implemented actionbar pattern across application

  -All menu options are moved to actionbar actions
  -CustomActionbar class is added which will inflate from the custom_actionbar xml
",,,,baba saikiran,saikiranenjoys@gmail.com,Tapasya K H S,tapasyakhs@gmail.com,1337332882,1339073441,f5e89a696ce13de3f3f5fa8401b9c3f930ca9a69
f5e89a696ce13de3f3f5fa8401b9c3f930ca9a69,f5e89a69,condition check added to avoid the null access,"condition check added to avoid the null access
",,,,baba saikiran,saikiranenjoys@gmail.com,Tapasya K H S,tapasyakhs@gmail.com,1337332579,1339073441,12e8e2544aa3daa9d7b7df5ad76b50cdf812b4da
12e8e2544aa3daa9d7b7df5ad76b50cdf812b4da,12e8e254,spacing code is commented in DashboardLayout to work with portrait and landscape modes,"spacing code is commented in DashboardLayout to work with portrait and landscape modes
",,,,baba saikiran,saikiranenjoys@gmail.com,Tapasya K H S,tapasyakhs@gmail.com,1337332407,1339073388,93d5055623b5590b3dc249a4e4f3baab55a55832
93d5055623b5590b3dc249a4e4f3baab55a55832,93d50556,settings icon is removed and recent icon is added to the dashboard,"settings icon is removed and recent icon is added to the dashboard

	setting are moved to the actionbar.
",,,,baba saikiran,saikiranenjoys@gmail.com,Tapasya K H S,tapasyakhs@gmail.com,1337332063,1339073388,d7f9b8c43426b752a5ac18fd2ac4ba211cfc81a2
d7f9b8c43426b752a5ac18fd2ac4ba211cfc81a2,d7f9b8c4,progress dialog added while validating the Rest url,"progress dialog added while validating the Rest url

	-changed the defalut URl
	-added string used to show the progress dialog
",,,,baba saikiran,saikiranenjoys@gmail.com,Tapasya K H S,tapasyakhs@gmail.com,1337331981,1339073387,d89419b2ba5548ffa316e4aec12e225c73937b0b
d89419b2ba5548ffa316e4aec12e225c73937b0b,d89419b2,background colors are changed for better visiblity of the sort config items,"background colors are changed for better visiblity of the sort config items
",,,,baba saikiran,saikiranenjoys@gmail.com,Tapasya K H S,tapasyakhs@gmail.com,1337331441,1339073387,6a9b30532b42480cd8ca15e62740e857b7780879
6a9b30532b42480cd8ca15e62740e857b7780879,6a9b3053,Condition enabled to check if the softinput is active before dismissing it,"Condition enabled to check if the softinput is active before dismissing it
",,,,baba saikiran,saikiranenjoys@gmail.com,Tapasya K H S,tapasyakhs@gmail.com,1337330812,1339073387,e0333622398af6f7eac6d8840449c18337b7f454
e0333622398af6f7eac6d8840449c18337b7f454,e0333622,Fixed query format error in Rest API call,"Fixed query format error in Rest API call

	changed the identifier to lowercase
",,,,baba saikiran,saikiranenjoys@gmail.com,Tapasya K H S,tapasyakhs@gmail.com,1337330429,1339073387,27f7019c45edae93761ed610f92d011a131dea11
27f7019c45edae93761ed610f92d011a131dea11,27f7019c,updated new images,"updated new images

   -Added actionbar related images
   -Applauncher modified images were added
   -Added images for multiple resolutions
",,,,baba saikiran,saikiranenjoys@gmail.com,Tapasya K H S,tapasyakhs@gmail.com,1337329805,1339073387,293ca20598fdaa7c977e5e4d54cbb53e9081264c
293ca20598fdaa7c977e5e4d54cbb53e9081264c,293ca205,added method cancel the notification,"added method cancel the notification
",,,,baba saikiran,saikiranenjoys@gmail.com,Tapasya K H S,tapasyakhs@gmail.com,1336462183,1339073387,7c8a1a9d8e94da6547206d558768fbfa820ccd61
7c8a1a9d8e94da6547206d558768fbfa820ccd61,7c8a1a9d,fixed NPE and enabled action bar for non-tabs,"fixed NPE and enabled action bar for non-tabs
",,,,Chander S Pechetty,chanderspechetty@gmail.com,Chander S Pechetty,chanderspechetty@gmail.com,1337609420,1337609420,d0e8484c184cee21caf4a23c5773d9172ebf9684
d0e8484c184cee21caf4a23c5773d9172ebf9684,d0e8484c,updated the header to have logo and simple background,"updated the header to have logo and simple background

updated the header to have logo and simple white background instead of
the image an created new styles for url label and text.",,,,Chander S Pechetty,chanderspechetty@gmail.com,Chander S Pechetty,chanderspechetty@gmail.com,1337609295,1337609295,84213db5c4de0872791d68a9fca31bcc0bb71944
84213db5c4de0872791d68a9fca31bcc0bb71944,84213db5,added deprecated tag,"added deprecated tag

enable it only if you are sure you want to support 1.6 and test all
functionalities on 1.6 making sure none of the new SDK API's are  used
",,,,Chander S Pechetty,chanderspechetty@gmail.com,Chander S Pechetty,chanderspechetty@gmail.com,1334912888,1334912888,8742ccd9a2b624c29e7cb3ad61a85a9702351510
8742ccd9a2b624c29e7cb3ad61a85a9702351510,8742ccd9,updated the TODO,"updated the TODO
",,,,Chander S Pechetty,chanderspechetty@gmail.com,Chander S Pechetty,chanderspechetty@gmail.com,1334912753,1334912753,97f365483a9d8b89467ca6c0fdbe4a54c0e7c366
97f365483a9d8b89467ca6c0fdbe4a54c0e7c366,97f36548,sessionid check has been removed from the AuthWizd,"sessionid check has been removed from the AuthWizd

Session id check has been removed from here. reaquring a session has
been enable in SugarCrmApp.java, but its too fragile
",,,,Chander S Pechetty,chanderspechetty@gmail.com,Chander S Pechetty,chanderspechetty@gmail.com,1334912659,1334912659,8b18aa9139b71b8db1350f3ee8c459fe52e04bc4
8b18aa9139b71b8db1350f3ee8c459fe52e04bc4,8b18aa91,added an account NPE check,"added an account NPE check
",,,,Chander S Pechetty,chanderspechetty@gmail.com,Chander S Pechetty,chanderspechetty@gmail.com,1329728568,1329728568,84f503f4f8e2c008e57ab1c05cd560e7dd307c1f
84f503f4f8e2c008e57ab1c05cd560e7dd307c1f,84f503f4,"added a Halo theme, but needs to look better","added a Halo theme, but needs to look better

added a Halo theme to check the dialog kind of interface on tab. will
look nice with a dialog theme, so convert to a theme which looks good on
both phone and tab (TODO)
",,,,Chander S Pechetty,chanderspechetty@gmail.com,Chander S Pechetty,chanderspechetty@gmail.com,1329728472,1329728472,73781b768c2feaaacaa1cb66736d2663d5c1a7f1
73781b768c2feaaacaa1cb66736d2663d5c1a7f1,73781b76,using BaseMultiPaneActivity to open detailscreen,"using BaseMultiPaneActivity to open detailscreen

using the BaseMultipaneActivity to open the detail screen and converting
the fragment Arguments to intent properly
",,,,Chander S Pechetty,chanderspechetty@gmail.com,Chander S Pechetty,chanderspechetty@gmail.com,1329728363,1329728363,e85fe6b731e7f9b4bf5feb4888781264c0c63379
e85fe6b731e7f9b4bf5feb4888781264c0c63379,e85fe6b7,added a null check for header text and cursor,"added a null check for header text and cursor

fixes a bug when cursor count is zero, the contents should not be set
",,,,Chander S Pechetty,chanderspechetty@gmail.com,Chander S Pechetty,chanderspechetty@gmail.com,1329728181,1329728254,db198a758021ca7a40e19755dc1db575046a2792
db198a758021ca7a40e19755dc1db575046a2792,db198a75,updated for Pancake,"updated for Pancake

updated the styles, dashboard button , and images and layouts for the
pancake logo and brand
",,,,Chander S Pechetty,chanderspechetty@gmail.com,Chander S Pechetty,chanderspechetty@gmail.com,1329728099,1329728099,d211b97e00c9ad4260cdb7dc983e5b7523259d51
d211b97e00c9ad4260cdb7dc983e5b7523259d51,d211b97e,dashboard layout for landscape-needs to worked om,"dashboard layout for landscape-needs to worked om

dashboard
",,,,Chander S Pechetty,chanderspechetty@gmail.com,Chander S Pechetty,chanderspechetty@gmail.com,1329727705,1329727791,ab86c2255ccc0b445692bb848b2442c5acc51e33
ab86c2255ccc0b445692bb848b2442c5acc51e33,ab86c225,new image assets,"new image assets
",,,,Chander S Pechetty,chanderspechetty@gmail.com,Chander S Pechetty,chanderspechetty@gmail.com,1329727598,1329727598,43fd7ba4274187a36c5b01a50a21f074cccd2497
43fd7ba4274187a36c5b01a50a21f074cccd2497,43fd7ba4,added the Meetings and Campaign image icons,"added the Meetings and Campaign image icons
",,,,Chander S Pechetty,chanderspechetty@gmail.com,Chander S Pechetty,chanderspechetty@gmail.com,1329727436,1329727436,76a81548e3c5a832eaff3ec934876fab82b565b0
76a81548e3c5a832eaff3ec934876fab82b565b0,76a81548,updated the Dashboard to the new UX,"updated the Dashboard to the new UX

updated the Dashboard to use the new UX and also use Fragment for reuse
on phone and tablet. uses the DashboardLayout used in the Google IO app
with small tweaks
",,,,Chander S Pechetty,chanderspechetty@gmail.com,Chander S Pechetty,chanderspechetty@gmail.com,1328602868,1328602868,59d3ff611c557277a2f82d6256b6eeacd91bfb31
59d3ff611c557277a2f82d6256b6eeacd91bfb31,59d3ff61,commented the header,"commented the header
",,,,Chander S Pechetty,chanderspechetty@gmail.com,Chander S Pechetty,chanderspechetty@gmail.com,1328602703,1328602703,545eb2fcbcf8221de6845ffc9c8083bc4c0939df
545eb2fcbcf8221de6845ffc9c8083bc4c0939df,545eb2fc,added Pancake Themese and deleted the old images,"added Pancake Themese and deleted the old images
",,,,Chander S Pechetty,chanderspechetty@gmail.com,Chander S Pechetty,chanderspechetty@gmail.com,1330416951,1330416951,734cd1f5c96698e23331cdff72f50a7f22ff10af
734cd1f5c96698e23331cdff72f50a7f22ff10af,734cd1f5,added custom themes for different platforms,"added custom themes for different platforms

added custom theme when the application is running on Android 3.0 (API
Level 11) or higher.
",,,,Chander S Pechetty,chanderspechetty@gmail.com,Chander S Pechetty,chanderspechetty@gmail.com,1325780328,1325780328,95b6314d3b75a01f6a30986ba5fad8bbe0fcf44c
95b6314d3b75a01f6a30986ba5fad8bbe0fcf44c,95b6314d,initial version,initial version,,,,Chander S Pechetty,chanderspechetty@gmail.com,Chander S Pechetty,chanderspechetty@gmail.com,1325779984,1325779984,ec7416b9722a043ca01ba9e230e445ad027edc04
ec7416b9722a043ca01ba9e230e445ad027edc04,ec7416b9,initial version,initial version,,,,Chander S Pechetty,chanderspechetty@gmail.com,Chander S Pechetty,chanderspechetty@gmail.com,1325779808,1325779808,1124e673a4efa8ea9e7875079e6709f4da3658d7
1124e673a4efa8ea9e7875079e6709f4da3658d7,1124e673,fix for the Invalid sessionId error from sugar crm server,"fix for the Invalid sessionId error from sugar crm server

fix for the Invalid sessionId error from sugar crm server. after prolonged periods if app is
opened, the session gets expired and is not handled by Rest API's. To circumvent that,
session id expiration is currently handled in SugarCrmApp.getSessionId based on a fixed
time for renewing the session. If this fixed time is not enough then the
 ""Invalid session Ids"" are not propagated back, so we keep the time low for
the time being and check for sessionId when updating the data on the server.
",,,,Chander S Pechetty,chanderspechetty@gmail.com,Chander S Pechetty,chanderspechetty@gmail.com,1325684059,1325684059,bf97a832f687813baddeb2c66f5d2a806e1881d1
bf97a832f687813baddeb2c66f5d2a806e1881d1,bf97a832,removed the newInstance method and refactored the other code,"removed the newInstance method and refactored the other code
",,,,Chander S Pechetty,chanderspechetty@gmail.com,Chander S Pechetty,chanderspechetty@gmail.com,1325683961,1325683961,0635064235be93bb3d041f52e4a145a91ce8460e
0635064235be93bb3d041f52e4a145a91ce8460e,06350642,removed unused and commented code,"removed unused and commented code
",,,,Chander S Pechetty,chanderspechetty@gmail.com,Chander S Pechetty,chanderspechetty@gmail.com,1325667271,1325667271,8a97fa0e7c6d77762d88ddb2805303747d51924d
8a97fa0e7c6d77762d88ddb2805303747d51924d,8a97fa0e,fixed crash on devices and simulators with no Maps and email,"fixed crash on devices and simulators with no Maps and email

fixed crash on devices and simulators with no Maps and email by using
Intent.createChooser to start an app which can handle the ""geo"" and mail
mime type
",,,,Chander S Pechetty,chander.p@imaginea.com,Chander S Pechetty,chanderspechetty@gmail.com,1325657952,1325657952,05982cca74de280be59e88a9955a36dcbbea8a56
05982cca74de280be59e88a9955a36dcbbea8a56,05982cca,cleanup some log statements and refactored the code,cleanup some log statements and refactored the code,,,,Chander S Pechetty,chanderspechetty@gmail.com,Chander S Pechetty,chanderspechetty@gmail.com,1325488223,1325488223,3e7987889caaac67c69b8f2c586f633b039a743d
3e7987889caaac67c69b8f2c586f633b039a743d,3e798788,fixed bugs in validation and saving of record,"fixed bugs in validation and saving of record

fixed assigned_user_name validation bug because of incorrect closing
of braces added by import contact functionality. Setting the uri by
getting the correct Intent for the fragment before sending for update.",,,,Chander S Pechetty,chanderspechetty@gmail.com,Chander S Pechetty,chanderspechetty@gmail.com,1325488140,1325488140,690e698569044368842d3b20f119685a0cc0630f
690e698569044368842d3b20f119685a0cc0630f,690e6985,added tablet support by creating fragments for reuse by tab and phone.,"added tablet support by creating fragments for reuse by tab and phone.

added tablet support by creating fragments for reuse by tab and phone.
The following files have been renamed to keep the history intact for the
smart phone Activities used earlier.

1. renamed ModuleDetailsActivity to ModuleDetailFragment.
2. renamed EditModuleDetailsActivity to EditModuleDetailFragment.
3. renamed RecentListActivity to RecentModuleListFragment.

In all fragments, removed setContentView and create the view in
onCreateView and added fragment lifecycle methods updated the protected
signatures of Activity for resume and stop to public. The design borrows
heavily from IOSched app, but also keeps the core logic built-in earlier
as is by including onActivityCreated.

TODO: 
1. The header methods will fail in the new single pane and
multi-pane activities , so dummy stubs have been added as a stop gap
till the UI for tablets and phones is standard-ized. 
2.The menus and actionbar settings are still pending for the same reason
as above.
",,,,Chander S Pechetty,chanderspechetty@gmail.com,Chander S Pechetty,chanderspechetty@gmail.com,1325347266,1325349329,dc5f884677af62a280872b8a012e15b3bbb1abfe
dc5f884677af62a280872b8a012e15b3bbb1abfe,dc5f8846,update to factor the android support compatibility package,"update to factor the android support compatibility package
",,,,Chander S Pechetty,chanderspechetty@gmail.com,Chander S Pechetty,chanderspechetty@gmail.com,1325247872,1325349176,88fa127a2abe7167dc5d0d37fe6342c6c6224299
88fa127a2abe7167dc5d0d37fe6342c6c6224299,88fa127a,initial version,"initial version
",,,,Chander S Pechetty,chanderspechetty@gmail.com,Chander S Pechetty,chanderspechetty@gmail.com,1325244032,1325349176,cf3d1837e5f55347ac4e398fdb0a9946a960f3c6
cf3d1837e5f55347ac4e398fdb0a9946a960f3c6,cf3d1837,initial version,"initial version
",,,,Chander S Pechetty,chanderspechetty@gmail.com,Chander S Pechetty,chanderspechetty@gmail.com,1325243903,1325349176,666383039580cada9610230e99b014401138b711
666383039580cada9610230e99b014401138b711,66638303,formatted and fixed typo for view id,"formatted and fixed typo for view id
",,,,Chander S Pechetty,chanderspechetty@gmail.com,Chander S Pechetty,chanderspechetty@gmail.com,1325243838,1325349176,f8559469e379ca4bf31a85c12f83fa519c026a53
f8559469e379ca4bf31a85c12f83fa519c026a53,f8559469,initial version,"initial version

layout used by framework for base activity classes to manage fragments
on phones and tablets.
",,,,Chander S Pechetty,chanderspechetty@gmail.com,Chander S Pechetty,chanderspechetty@gmail.com,1325243343,1325349176,64860db3b7025a8e9dd459744a17486b9eb7c847
64860db3b7025a8e9dd459744a17486b9eb7c847,64860db3,initial version,"initial version

framework for base activity classes to manage fragments on phones and
tablets borrowed from the iosched app.
",,,,Chander S Pechetty,chanderspechetty@gmail.com,Chander S Pechetty,chanderspechetty@gmail.com,1325242846,1325349176,79494dd9385a5595f1395b2af46eea4833fbe16a
79494dd9385a5595f1395b2af46eea4833fbe16a,79494dd9,Merge branch 'master' of github.com:Imaginea/sugarcrm-android,"Merge branch 'master' of github.com:Imaginea/sugarcrm-android
",,,,Chander S Pechetty,chanderspechetty@gmail.com,Chander S Pechetty,chanderspechetty@gmail.com,1325160399,1325160399,"d9789ec88538300697523a42b81eeda721d2b89c,85c4bbf958d2a673be49f7a0c641e2165198107a"
d9789ec88538300697523a42b81eeda721d2b89c,d9789ec8,added the global preference for turning on/off alarms,"added the global preference for turning on/off alarms
",,,,Tapasya K H S,tapasyakhs@gmail.com,Chander S Pechetty,chanderspechetty@gmail.com,1325158478,1325159642,8afb06b52925da53c24a46bdfe494f34f4704045
8afb06b52925da53c24a46bdfe494f34f4704045,8afb06b5,added notification support for the meetings module,"added notification support for the meetings module
",,,,Tapasya K H S,tapasyakhs@gmail.com,Chander S Pechetty,chanderspechetty@gmail.com,1325158411,1325159642,3fa56ffdec3601c2ab4ea065fd37f90730758ed3
3fa56ffdec3601c2ab4ea065fd37f90730758ed3,3fa56ffd,helper classes for showing notifications,"helper classes for showing notifications
",,,,Tapasya K H S,tapasyakhs@gmail.com,Chander S Pechetty,chanderspechetty@gmail.com,1325158194,1325159642,1e5a8cbe2e42fcafd3649a4e5de118f4b498b65b
