id,short_id,title,message,additions,deletions,total,author_name,author_email,committer_name,committer_email,authored_date,committed_date,parent_ids
77ceddb664d3e34d82aa878303534d9a8aafbbd0,77ceddb6,new setup instruction strings,new setup instruction strings,,,,Michal Lower,keton22@gmail.com,Michal Lower,keton22@gmail.com,1390982055,1390982055,8417ee39bca64b315e77dabbbfd4b6e57208b6a6
8417ee39bca64b315e77dabbbfd4b6e57208b6a6,8417ee39,Improved extension show/hide logic,"Improved extension show/hide logic
New icons",,,,Michal Lower,keton22@gmail.com,Michal Lower,keton22@gmail.com,1390981556,1390981556,c2cf54756405b1c6eda2c704871fe686c8729c90
c2cf54756405b1c6eda2c704871fe686c8729c90,c2cf5475,manifest update to hide PendingIntentLauncher from task switcher.,manifest update to hide PendingIntentLauncher from task switcher.,,,,Michal Lower,keton22@gmail.com,Michal Lower,keton22@gmail.com,1390953381,1390953381,7e620a54de9e334411540ab67d7d2384a4b8f467
7e620a54de9e334411540ab67d7d2384a4b8f467,7e620a54,comments and code cleanup,comments and code cleanup,,,,Michal Lower,keton22@gmail.com,Michal Lower,keton22@gmail.com,1390951031,1390951031,1dab26af4d4930a5a8f5af91362ad73075e49a19
1dab26af4d4930a5a8f5af91362ad73075e49a19,1dab26af,Extension captures PendingIntents form clock notification and executes,"Extension captures PendingIntents form clock notification and executes
it as onClickIntents. DeskClock doesn't allow it straight away so
PendingIntentLauncher activity was created.",,,,Michal Lower,keton22@gmail.com,Michal Lower,keton22@gmail.com,1390950262,1390950262,1d166f470cf7693a8e523e9b1c92d100c02739c6
1d166f470cf7693a8e523e9b1c92d100c02739c6,1d166f47,Message displayed when notification service isn't set up properly is now,"Message displayed when notification service isn't set up properly is now
read from strings.xml and translated to Polish",,,,Michal Lower,keton22@gmail.com,Michal Lower,keton22@gmail.com,1390938133,1390938133,242776f40459a56e421cb6800d411cc639452f96
242776f40459a56e421cb6800d411cc639452f96,242776f4,Added Polish translation,Added Polish translation,,,,Michal Lower,keton22@gmail.com,Michal Lower,keton22@gmail.com,1389951551,1389951551,200206491816d9befe048758b6cbd744fcedbc73
200206491816d9befe048758b6cbd744fcedbc73,20020649,"Fixups in Eclipse project, take 2","Fixups in Eclipse project, take 2",,,,Michal Lower,keton22@gmail.com,Michal Lower,keton22@gmail.com,1389745929,1389745929,c215ded31608bd0437f576f19972c1df5e41a897
c215ded31608bd0437f576f19972c1df5e41a897,c215ded3,General cleanup and dependency fixing,General cleanup and dependency fixing,,,,Michal Lower,keton22@gmail.com,Michal Lower,keton22@gmail.com,1389745148,1389745148,25893a89960d808eb4cf278b3fcb763d7b8c8cae
25893a89960d808eb4cf278b3fcb763d7b8c8cae,25893a89,initial commit,initial commit,,,,Michal Lower,keton22@gmail.com,Michal Lower,keton22@gmail.com,1389744416,1389744416,0c45f029f9f89fd1f811b4840a861076e1784801
0c45f029f9f89fd1f811b4840a861076e1784801,0c45f029,Initial commit,"Initial commit
",,,,keton,keton22@gmail.com,keton,keton22@gmail.com,1389744178,1389744178,
