id,short_id,title,message,additions,deletions,total,author_name,author_email,committer_name,committer_email,authored_date,committed_date,parent_ids
b96ee95730389c32df45fee0e99cea394bd7629f,b96ee957,Self Image showing up correctly,Self Image showing up correctly,,,,AndruByrne,anthropic.android@gmail.com,AndruByrne,anthropic.android@gmail.com,1391830080,1391830080,3470c88961f6bbbd28bf35b0a14e7023f1f704d9
3470c88961f6bbbd28bf35b0a14e7023f1f704d9,3470c889,"using encryption, and displaying self profile pic","using encryption, and displaying self profile pic",,,,AndruByrne,anthropic.android@gmail.com,AndruByrne,anthropic.android@gmail.com,1391813608,1391813608,1579f893f0d8dc99a0b669e1ef590706c9acfd59
1579f893f0d8dc99a0b669e1ef590706c9acfd59,1579f893,Added license!,Added license!,,,,AndruByrne,anthropic.android@gmail.com,AndruByrne,anthropic.android@gmail.com,1391799660,1391799660,72ac718f96b5c979d5a7c239e5ad9963523b266b
72ac718f96b5c979d5a7c239e5ad9963523b266b,72ac718f,added crypto utilities,added crypto utilities,,,,AndruByrne,anthropic.android@gmail.com,AndruByrne,anthropic.android@gmail.com,1391799450,1391799450,c6b1ceb1a1980dc93cda278bcd5d516f6a1fa547
c6b1ceb1a1980dc93cda278bcd5d516f6a1fa547,c6b1ceb1,"Created new NFC notifications, made retry clickable","Created new NFC notifications, made retry clickable",,,,AndruByrne,anthropic.android@gmail.com,AndruByrne,anthropic.android@gmail.com,1388746678,1388746678,252100e03b0415b0bbc04bd1a76afb709d116702
252100e03b0415b0bbc04bd1a76afb709d116702,252100e0,"Changed nfc buttons, checking for nfc null","Changed nfc buttons, checking for nfc null",,,,AndruByrne,anthropic.android@gmail.com,AndruByrne,anthropic.android@gmail.com,1388738258,1388738258,c1c9b77a888f6e74fe31ee8832134287e0843d29
c1c9b77a888f6e74fe31ee8832134287e0843d29,c1c9b77a,Both bars sizing correctly,Both bars sizing correctly,,,,AndruByrne,anthropic.android@gmail.com,AndruByrne,anthropic.android@gmail.com,1388650489,1388650489,d1a1f3a86b6fbe1b498e1b837125538d451ff34b
d1a1f3a86b6fbe1b498e1b837125538d451ff34b,d1a1f3a8,transparent statusbars,transparent statusbars,,,,AndruByrne,anthropic.android@gmail.com,AndruByrne,anthropic.android@gmail.com,1388632032,1388632032,4f9104be23e239aafcaca6cf10a98c80f0fa9763
4f9104be23e239aafcaca6cf10a98c80f0fa9763,4f9104be,"got green bar to appear, pushing screen","got green bar to appear, pushing screen",,,,AndruByrne,anthropic.android@gmail.com,AndruByrne,anthropic.android@gmail.com,1388516391,1388516391,d8a6925033b362a561f1b7e76dc5122fab0a5fad
d8a6925033b362a561f1b7e76dc5122fab0a5fad,d8a69250,"reformed strings, app is sending nfc to browser","reformed strings, app is sending nfc to browser",,,,AndruByrne,anthropic.android@gmail.com,AndruByrne,anthropic.android@gmail.com,1387775469,1387775469,285824378c8b907dda15e8cff42003f280bdbd40
285824378c8b907dda15e8cff42003f280bdbd40,28582437,"NFC not crashing, may still be opening in self activity","NFC not crashing, may still be opening in self activity",,,,AndruByrne,anthropic.android@gmail.com,AndruByrne,anthropic.android@gmail.com,1387583824,1387583824,40ebf75b4a982e52ce7de358f3fafe9a9e35e4e2
40ebf75b4a982e52ce7de358f3fafe9a9e35e4e2,40ebf75b,"NFS, new twitter button","NFS, new twitter button",,,,AndruByrne,anthropic.android@gmail.com,AndruByrne,anthropic.android@gmail.com,1387568286,1387568286,5d43f515cd036987966307ba093771a1ac300a0d
5d43f515cd036987966307ba093771a1ac300a0d,5d43f515,"tightened up code, added locationClient unregistration","tightened up code, added locationClient unregistration",,,,AndruByrne,anthropic.android@gmail.com,AndruByrne,anthropic.android@gmail.com,1386785755,1386785755,746d52dd53f26f6e114bca03450ba5b0a209dec2
746d52dd53f26f6e114bca03450ba5b0a209dec2,746d52dd,Twitter response handled,Twitter response handled,,,,AndruByrne,anthropic.android@gmail.com,AndruByrne,anthropic.android@gmail.com,1386745534,1386745534,ec655accd7fe8d2e284d5faca8ca171aa85d1c1a
ec655accd7fe8d2e284d5faca8ca171aa85d1c1a,ec655acc,Twitter profiles showing,Twitter profiles showing,,,,AndruByrne,anthropic.android@gmail.com,AndruByrne,anthropic.android@gmail.com,1386621131,1386621131,b666b51ce24f4027d8ab01a7029bb4e8b1bc77b4
b666b51ce24f4027d8ab01a7029bb4e8b1bc77b4,b666b51c,"implemented gson, have twitter profile pic url in NoSQL, it is crashing in the…","implemented gson, have twitter profile pic url in NoSQL, it is crashing in the twitter frag b/c network in UI",,,,AndruByrne,anthropic.android@gmail.com,AndruByrne,anthropic.android@gmail.com,1386573710,1386573710,d401ade008fb61ff1df723e1dcf3bc0b1787fa64
d401ade008fb61ff1df723e1dcf3bc0b1787fa64,d401ade0,Now get twitter ID!!!!,Now get twitter ID!!!!,,,,AndruByrne,anthropic.android@gmail.com,AndruByrne,anthropic.android@gmail.com,1386500720,1386500720,d8e645355730d6e61fa5bc0bfbb759510861ed65
d8e645355730d6e61fa5bc0bfbb759510861ed65,d8e64535,What got built with NFC notes,What got built with NFC notes,,,,AndruByrne,anthropic.android@gmail.com,AndruByrne,anthropic.android@gmail.com,1386490023,1386490023,dae6c4408d62d339a3d9cec25c8b3e9644134eb4
dae6c4408d62d339a3d9cec25c8b3e9644134eb4,dae6c440,Twitter login implemented,Twitter login implemented,,,,AndruByrne,anthropic.android@gmail.com,AndruByrne,anthropic.android@gmail.com,1386361458,1386361458,286c2dd6dc64236cc709e8b28741a3025fd1949d
286c2dd6dc64236cc709e8b28741a3025fd1949d,286c2dd6,"Tried all three methods, still havingtrouble with the fb confirm, cahnged app…","Tried all three methods, still havingtrouble with the fb confirm, cahnged app settings in fb, also added backgrounds for portrait",,,,AndruByrne,anthropic.android@gmail.com,AndruByrne,anthropic.android@gmail.com,1386321432,1386321432,c7d030c9f4b1a116d1b6003cfcbbb7077fe4c389
c7d030c9f4b1a116d1b6003cfcbbb7077fe4c389,c7d030c9,"Connecting through fb to make friends, need to expand population to include names","Connecting through fb to make friends, need to expand population to include names",,,,AndruByrne,anthropic.android@gmail.com,AndruByrne,anthropic.android@gmail.com,1386200352,1386200352,9cfe02f912178a32540624e043876d0f4af93ec9
9cfe02f912178a32540624e043876d0f4af93ec9,9cfe02f9,"Correctly addressing the pagerfragment, but the findviewbyID for hte fb widget is not working","Correctly addressing the pagerfragment, but the findviewbyID for hte fb widget is not working",,,,AndruByrne,anthropic.android@gmail.com,AndruByrne,anthropic.android@gmail.com,1386044976,1386044976,958d13d24b971d3f739dcf5284d8db85d9ba8fec
958d13d24b971d3f739dcf5284d8db85d9ba8fec,958d13d2,using ssh keys,using ssh keys,,,,AndruByrne,anthropic.android@gmail.com,AndruByrne,anthropic.android@gmail.com,1385883163,1385883163,5f5522682226a438c01cbddc15ce6b11573ba1cf
5f5522682226a438c01cbddc15ce6b11573ba1cf,5f552268,set currentRadius threshold for dialog,set currentRadius threshold for dialog,,,,Andrew Byrne,crepuscular.worker@gmail.com,Andrew Byrne,crepuscular.worker@gmail.com,1385882160,1385882160,06cb6cab75ff3b2e1c2637084c8fe0c168324e60
06cb6cab75ff3b2e1c2637084c8fe0c168324e60,06cb6cab,"Concat lookfor and nearARoom, dialog needed activity not cxt","Concat lookfor and nearARoom, dialog needed activity not cxt",,,,Andrew Byrne,crepuscular.worker@gmail.com,Andrew Byrne,crepuscular.worker@gmail.com,1385882028,1385882028,8e2d7cb68cd1805494f79d899d67163dfd183a49
8e2d7cb68cd1805494f79d899d67163dfd183a49,8e2d7cb6,"Removed Room class, added too_large error dialog, but it is having trouble with the context","Removed Room class, added too_large error dialog, but it is having trouble with the context",,,,Andrew Byrne,crepuscular.worker@gmail.com,Andrew Byrne,crepuscular.worker@gmail.com,1385880758,1385880758,6323d0943eddb5158639bbcf2813b24ef89eac12
6323d0943eddb5158639bbcf2813b24ef89eac12,6323d094,"init; location working, db writes, working on finding/creating rooms","init; location working, db writes, working on finding/creating rooms",,,,Andrew Byrne,crepuscular.worker@gmail.com,Andrew Byrne,crepuscular.worker@gmail.com,1385875511,1385875511,a6ad90b9f16d3480ffb00b565afeb3f3f708e4c4
a6ad90b9f16d3480ffb00b565afeb3f3f708e4c4,a6ad90b9,Initial commit,"Initial commit
",,,,Andrew Byrne,crepuscular.worker@gmail.com,Andrew Byrne,crepuscular.worker@gmail.com,1385874684,1385874684,
