commit_hash,tag_name,tag_message
8d8651d30f557f334a4b4c058c9fc453e18558b3,v1.0.6,"BlackBerry support, Schedule list implementation, DB clearing on logout, FB ActionBar button, Nav Drawer refactor"
e2476afb68256ef73286a29a551962cb016f9748,v1.0.5,Fix comparator bugs; reorder profile tabs; improve logging
a79f2b2a32dcff6d0bf1cd33365ff7d1535dcff7,v1.0.3,Make login much faster by loading after rendering basic info
09d650130ae8366c9bbebe5b2ab589a23910e89c,v1.0.2,Slightly faster initial load; loading spinners on profile screen
8e238463ec18c435416a2b2bec6bebe3d5255667,v1.0.1,Bug fixes for release apk; UI improvements for refreshing
956f594544f3741f54a63f03c81e965c844ddf1f,v1.0,Version 1.0 -- Initial release on Google Play Store
