id,short_id,title,message,additions,deletions,total,author_name,author_email,committer_name,committer_email,authored_date,committed_date,parent_ids
646d8852380120f27d02acdc9204587f42dc465b,646d8852,added block and schedule list to the locoprops view,added block and schedule list to the locoprops view,,,,rob,,rob,,1272018480,1272018480,91f5c04fe4622885976a028bb66711888866486f
91f5c04fe4622885976a028bb66711888866486f,91f5c04f,loco start/stop and manual added,loco start/stop and manual added,,,,rob,,rob,,1272007872,1272007872,3eb798bff35132de633feeeaf912f64913f2f3e9
3eb798bff35132de633feeeaf912f64913f2f3e9,3eb798bf,system commands for automode added,system commands for automode added,,,,rob,,rob,,1272006004,1272006004,ae848f4796155a8e98398198a703ff6545e652ed
ae848f4796155a8e98398198a703ff6545e652ed,ae848f47,regard the show flag for layout items,"regard the show flag for layout items
antialias flag for drawing the LEDButton",,,,rob,,rob,,1272003407,1272003407,37c60b6260d185fe0a1dad090dc3ce38e2f81ddb
37c60b6260d185fe0a1dad090dc3ce38e2f81ddb,37c60b62,save last selected locoID,"save last selected locoID
evaluate the fx attribute to show the function state",,,,rob,,rob,,1272001025,1272001025,13c1ace990d42dc64fd0ad903e2c1338fbc6ad76
13c1ace990d42dc64fd0ad903e2c1338fbc6ad76,13c1ace9,LEDButton for functions added,LEDButton for functions added,,,,rob,,rob,,1271972115,1271972115,c36ff8b379f3417d86f6bf8f7646b87173d7de41
c36ff8b379f3417d86f6bf8f7646b87173d7de41,c36ff8b3,get versionName and versionCode from package manager,get versionName and versionCode from package manager,,,,r.j.versluis@rocrail.net,,r.j.versluis@rocrail.net,,1271967868,1271967868,b7391f2af8a2f4caa9246d818bed1d9a15d3f808
b7391f2af8a2f4caa9246d818bed1d9a15d3f808,b7391f2a,menu sensitivity and stack added,menu sensitivity and stack added,,,,r.j.versluis@rocrail.net,,r.j.versluis@rocrail.net,,1271967097,1271967097,49e5b0f1df85658b99a5acd6b9442be764ef22e7
49e5b0f1df85658b99a5acd6b9442be764ef22e7,49e5b0f1,load loco image on event,load loco image on event,,,,rob,,rob,,1271963072,1271963072,f3cfcb75f2561a738cbbbd60c8253cb34064b5dc
f3cfcb75f2561a738cbbbd60c8253cb34064b5dc,f3cfcb75,updating of items added,updating of items added,,,,rob,,rob,,1271954490,1271954490,691997b68d4d8a9378c01c84d0a273d269425143
691997b68d4d8a9378c01c84d0a273d269425143,691997b6,fix for crash on empty datareq,fix for crash on empty datareq,,,,rob,,rob,,1271951502,1271951502,d5b1d123200838089c46dd85d8fd1bc73e4d3b7c
d5b1d123200838089c46dd85d8fd1bc73e4d3b7c,d5b1d123,fix for sensor and signal clicks,fix for sensor and signal clicks,,,,rob,,rob,,1271882660,1271882660,7ee3d009f58f82bda291c7faf2d02a6cbe3ae548
7ee3d009f58f82bda291c7faf2d02a6cbe3ae548,7ee3d009,"block, sensor and signal added","block, sensor and signal added",,,,r.j.versluis@rocrail.net,,r.j.versluis@rocrail.net,,1271878617,1271878617,eccc249567658ee726ba4f84fc40599a5251a567
eccc249567658ee726ba4f84fc40599a5251a567,eccc2495,track object added,track object added,,,,rob,,rob,,1271873640,1271873640,de92bbdb9c2345d4e3e226617d7e3322c9dea4fe
de92bbdb9c2345d4e3e226617d7e3322c9dea4fe,de92bbdb,symbols and switch types,symbols and switch types,,,,rob,,rob,,1271872250,1271872250,5b9e5a9a0803e2c745decca0a83a763d17bd66d5
5b9e5a9a0803e2c745decca0a83a763d17bd66d5,5b9e5a9a,start of localization,"start of localization
progress dialog until plan is parsed
titlebar update
layout symbols in res/raw",,,,rob,,rob,,1271865506,1271865506,a2a97fc091caa5f421937e69a9ee1804d661aaa4
a2a97fc091caa5f421937e69a9ee1804d661aaa4,a2a97fc0,scrolling the level view (WIP),scrolling the level view (WIP),,,,r.j.versluis@rocrail.net,,r.j.versluis@rocrail.net,,1271796091,1271796091,96274ad5dec84e8786eff190fc9cc8dcad55632b
96274ad5dec84e8786eff190fc9cc8dcad55632b,96274ad5,switches are added to the level view and are clickable,switches are added to the level view and are clickable,,,,rob,,rob,,1271790087,1271790087,6de629754926b14f72d4694e03ace4b981a7554c
6de629754926b14f72d4694e03ace4b981a7554c,6de62975,info view added,"info view added
progress dialog between connect and throttle view",,,,rob,,rob,,1271779569,1271779569,755cd669389ec352686ce3384cddb0676373d1c3
755cd669389ec352686ce3384cddb0676373d1c3,755cd669,removed the minimal version from the manifest,removed the minimal version from the manifest,,,,r.j.versluis@rocrail.net,,r.j.versluis@rocrail.net,,1271708732,1271708732,c719af867d3bc4f30ec724df70b49838176467ea
c719af867d3bc4f30ec724df70b49838176467ea,c719af86,level view added,level view added,,,,rob,,rob,,1271703053,1271703053,6ff230f5ba5c362235a5100135c7fc943e2d915a
6ff230f5ba5c362235a5100135c7fc943e2d915a,6ff230f5,added locoprops view,added locoprops view,,,,rob,,rob,,1271695858,1271695858,9e7e19b6c45199d1f4f8abc546f26a9c56ab574c
9e7e19b6c45199d1f4f8abc546f26a9c56ab574c,9e7e19b6,new default image and listing up the layout levels,new default image and listing up the layout levels,,,,rob,,rob,,1271693772,1271693772,066d7a12d9f84590103af2ea89231276155559ad
066d7a12d9f84590103af2ea89231276155559ad,066d7a12,info deviceId added,info deviceId added,,,,rob,,rob,,1271615861,1271615861,d7f64e1c94131010693d54681b44a8cd45c5b80f
d7f64e1c94131010693d54681b44a8cd45c5b80f,d7f64e1c,use full qualified package name for loading activity classes,use full qualified package name for loading activity classes,,,,rob,,rob,,1271614115,1271614115,0e5e973a67537a9eed724d825accb41a9b82ef6f
0e5e973a67537a9eed724d825accb41a9b82ef6f,0e5e973a,missing activities and some refactoring,missing activities and some refactoring,,,,rob,,rob,,1271605589,1271605589,f81499143c5258517e8dd9a4d6352568c6cecb14
f81499143c5258517e8dd9a4d6352568c6cecb14,f8149914,throttle rotation support: init with same loco and speed,throttle rotation support: init with same loco and speed,,,,rob,,rob,,1271601314,1271601314,33ed5dd5a70b69f2cd7fe59484af45d3837f3b53
33ed5dd5a70b69f2cd7fe59484af45d3837f3b53,33ed5dd5,finish activity after starting another one,finish activity after starting another one,,,,rob,,rob,,1271597207,1271597207,0b00daa491e2acc3eb941cb03f7f81288e82bbc9
0b00daa491e2acc3eb941cb03f7f81288e82bbc9,0b00daa4,matching all pieces togheter to get it working again,matching all pieces togheter to get it working again,,,,rob,,rob,,1271596230,1271596230,951250f4d0e3e410c78204d415e02e2230754382
951250f4d0e3e410c78204d415e02e2230754382,951250f4,using service (WIP),using service (WIP),,,,rob,,rob,,1271588602,1271588602,b62b2d827a552ad9426cfa296a160d075294a6ed
b62b2d827a552ad9426cfa296a160d075294a6ed,b62b2d82,reorganize application (WIP),reorganize application (WIP),,,,rob,,rob,,1271585088,1271585088,a6a240a24064d2aac302d1f141a742cc4fab8d61
a6a240a24064d2aac302d1f141a742cc4fab8d61,a6a240a2,reorganizing the app (WIP),reorganizing the app (WIP),,,,rob,,rob,,1271579345,1271579345,b9f1ba4c900cccc4433b2ddcacf60dd68d7c05f0
b9f1ba4c900cccc4433b2ddcacf60dd68d7c05f0,b9f1ba4c,reorganized structure for activities and service,reorganized structure for activities and service,,,,r.j.versluis@rocrail.net,,r.j.versluis@rocrail.net,,1271534559,1271534559,e26981d29c724d15bb6ce5a4b9312de4df154b06
e26981d29c724d15bb6ce5a4b9312de4df154b06,e26981d2,save last selected loco,save last selected loco,,,,r.j.versluis@rocrail.net,,r.j.versluis@rocrail.net,,1271507022,1271507022,a1b4c7c43225a68725cdd527cbf82000c52aec31
a1b4c7c43225a68725cdd527cbf82000c52aec31,a1b4c7c4,locoimage after selecting a loco from the list implemented,locoimage after selecting a loco from the list implemented,,,,r.j.versluis@rocrail.net,,r.j.versluis@rocrail.net,,1271497649,1271497649,f9f9d3a8e857b170da5aefcdf11dc5c678aabe5d
f9f9d3a8e857b170da5aefcdf11dc5c678aabe5d,f9f9d3a8,text size increased on system view,text size increased on system view,,,,r.j.versluis@rocrail.net,,r.j.versluis@rocrail.net,,1271495115,1271495115,7b05fbca359f96e8f5e95882d32ba39cf0b5549c
7b05fbca359f96e8f5e95882d32ba39cf0b5549c,7b05fbca,requesting and loading loco images,requesting and loading loco images,,,,r.j.versluis@rocrail.net,,r.j.versluis@rocrail.net,,1271494375,1271494375,879e0c72faf220e6b183f44ea28740c0b8159191
879e0c72faf220e6b183f44ea28740c0b8159191,879e0c72,the hasmap returns every time another instance of the Loco object; the list,the hasmap returns every time another instance of the Loco object; the list solution is a hack but works ,,,,r.j.versluis@rocrail.net,,r.j.versluis@rocrail.net,,1271480190,1271480190,03745329936b5891715ed9166c2c5d733a74c36f
03745329936b5891715ed9166c2c5d733a74c36f,03745329,added some type safety to lists and maps,added some type safety to lists and maps,,,,r.j.versluis@rocrail.net,,r.j.versluis@rocrail.net,,1271450789,1271450789,922db110f0b4ea818cc0b64a78afe91846ff80ba
922db110f0b4ea818cc0b64a78afe91846ff80ba,922db110,handling loco picture (WIP),handling loco picture (WIP),,,,r.j.versluis@rocrail.net,,r.j.versluis@rocrail.net,,1271441565,1271441565,3234ed7bf874a65769cb29a0348efc161ca28a51
3234ed7bf874a65769cb29a0348efc161ca28a51,3234ed7b,removed unused icons,removed unused icons,,,,r.j.versluis@rocrail.net,,r.j.versluis@rocrail.net,,1271435671,1271435671,65664bdffb60ba7ebba5a60899b561cd6e5ffdb3
65664bdffb60ba7ebba5a60899b561cd6e5ffdb3,65664bdf,50px height,50px height,,,,Rocrail,rob@rocbook,Rocrail,rob@rocbook,1271435633,1271435633,b6c6885cb43031e2140a1b4337e0f54342ce62b6
b6c6885cb43031e2140a1b4337e0f54342ce62b6,b6c6885c,"added 3 function groups: 1-8, 9-16, 17-24","added 3 function groups: 1-8, 9-16, 17-24",,,,r.j.versluis@rocrail.net,,r.j.versluis@rocrail.net,,1271434506,1271434506,0dac21d2716dba337a0841c1327c17b2384dfd72
0dac21d2716dba337a0841c1327c17b2384dfd72,0dac21d2,added implementation of the function buttons,added implementation of the function buttons,,,,r.j.versluis@rocrail.net,,r.j.versluis@rocrail.net,,1271426855,1271426855,87dda4ca9089b64eb816012f363a5052e109ac5e
87dda4ca9089b64eb816012f363a5052e109ac5e,87dda4ca,loco speed implemented,loco speed implemented,,,,r.j.versluis@rocrail.net,,r.j.versluis@rocrail.net,,1271421719,1271421719,fcd99bb0b732bd9b695d5bc7c6a94ebcf01ad139
fcd99bb0b732bd9b695d5bc7c6a94ebcf01ad139,fcd99bb0,loco selection and lights on/off,loco selection and lights on/off,,,,r.j.versluis@rocrail.net,,r.j.versluis@rocrail.net,,1271416001,1271416001,fdd8294dc547b3fb656c30b6968c0e51fa99b7d4
fdd8294dc547b3fb656c30b6968c0e51fa99b7d4,fdd8294d,update spinner from thread,update spinner from thread,,,,r.j.versluis@rocrail.net,,r.j.versluis@rocrail.net,,1271403868,1271403868,3cdc0c35ed83c3dda99c337c0086b1b4e9245e4e
3cdc0c35ed83c3dda99c337c0086b1b4e9245e4e,3cdc0c35,loco list parsed and saved in the model,loco list parsed and saved in the model,,,,r.j.versluis@rocrail.net,,r.j.versluis@rocrail.net,,1271402732,1271402732,dcc64786135e055fe692562f627667f07fe24bcc
dcc64786135e055fe692562f627667f07fe24bcc,dcc64786,added model listener concept,added model listener concept,,,,r.j.versluis@rocrail.net,,r.j.versluis@rocrail.net,,1271396890,1271396890,3be7c153e05eecce4e547f15e43a6b5acfa1f07a
3be7c153e05eecce4e547f15e43a6b5acfa1f07a,3be7c153,added interfaces,added interfaces,,,,r.j.versluis@rocrail.net,,r.j.versluis@rocrail.net,,1271394575,1271394575,18f1b9b035f4c1fc7f4eedd0150e864c4862ac85
18f1b9b035f4c1fc7f4eedd0150e864c4862ac85,18f1b9b0,commented out the minSDKVersion,commented out the minSDKVersion,,,,r.j.versluis@rocrail.net,,r.j.versluis@rocrail.net,,1271364345,1271364345,b540f5fa47eed13fab57522512b237507ef391fd
b540f5fa47eed13fab57522512b237507ef391fd,b540f5fa,menu constants added,menu constants added,,,,rob,,rob,,1271362846,1271362846,dacbba69a17423775ccb4cb27d3d7d4b6291b764
dacbba69a17423775ccb4cb27d3d7d4b6291b764,dacbba69,bold text style in buttons and initfield command,bold text style in buttons and initfield command,,,,r.j.versluis@rocrail.net,,r.j.versluis@rocrail.net,,1271360931,1271360931,12875548d7a448cef371539b0d55930ec7d1ab6a
12875548d7a448cef371539b0d55930ec7d1ab6a,12875548,init view every time it is loaded,init view every time it is loaded,,,,r.j.versluis@rocrail.net,,r.j.versluis@rocrail.net,,1271359442,1271359442,4acc67b481633cf994bd69fd7be8032b6de58fa1
4acc67b481633cf994bd69fd7be8032b6de58fa1,4acc67b4,power ON/OFF implemented,power ON/OFF implemented,,,,r.j.versluis@rocrail.net,,r.j.versluis@rocrail.net,,1271356691,1271356691,fad7a9f107962aa9eeba63279fec2db46f17b5e1
fad7a9f107962aa9eeba63279fec2db46f17b5e1,fad7a9f1,parser is working,parser is working,,,,r.j.versluis@rocrail.net,,r.j.versluis@rocrail.net,,1271355235,1271355235,b320a63fb8eef2427d53f8b8ca7a374dce5ade6c
b320a63fb8eef2427d53f8b8ca7a374dce5ade6c,b320a63f,added xml handler and the read logic,added xml handler and the read logic,,,,r.j.versluis@rocrail.net,,r.j.versluis@rocrail.net,,1271347826,1271347826,a5599128376338cc248bb5fdd01dc94d00ef071d
a5599128376338cc248bb5fdd01dc94d00ef071d,a5599128,sax parsing WIP,sax parsing WIP,,,,r.j.versluis@rocrail.net,,r.j.versluis@rocrail.net,,1271271659,1271271659,65870d0b078c1b4ae5747ff4f162968571142798
65870d0b078c1b4ae5747ff4f162968571142798,65870d0b,base for sax parsing the rocrail server messages,base for sax parsing the rocrail server messages,,,,r.j.versluis@rocrail.net,,r.j.versluis@rocrail.net,,1271270492,1271270492,0fc675044cb7cc799682c38760c0c01c3534edbc
0fc675044cb7cc799682c38760c0c01c3534edbc,0fc67504,initial connection with rocrail.dyndns.org succeeded,initial connection with rocrail.dyndns.org succeeded,,,,r.j.versluis@rocrail.net,,r.j.versluis@rocrail.net,,1271265254,1271265254,4c0999e0165238bc77b1b70d9763fa41d5e00199
4c0999e0165238bc77b1b70d9763fa41d5e00199,4c0999e0,added system classes and start of connection,added system classes and start of connection,,,,r.j.versluis@rocrail.net,,r.j.versluis@rocrail.net,,1271263017,1271263017,f208e46a5836c6e17ca4cbd0cdb629de8c22aaff
f208e46a5836c6e17ca4cbd0cdb629de8c22aaff,f208e46a,replaced tabview with application menu,"replaced tabview with application menu
added connect and system view",,,,r.j.versluis@rocrail.net,,r.j.versluis@rocrail.net,,1271256455,1271256455,8623ad62eb5b10d0b504d0618a2a16c4266efc81
8623ad62eb5b10d0b504d0618a2a16c4266efc81,8623ad62,layout and tab icons,layout and tab icons,,,,r.j.versluis@rocrail.net,,r.j.versluis@rocrail.net,,1271173961,1271173961,ba13e0320961f9baf8cbaff3fb1f29227cd10417
ba13e0320961f9baf8cbaff3fb1f29227cd10417,ba13e032,eclipse files,eclipse files,,,,r.j.versluis@rocrail.net,,r.j.versluis@rocrail.net,,1271170903,1271170903,bfef2250b3949cb4fe60b32bc9d46c9c50398f82
bfef2250b3949cb4fe60b32bc9d46c9c50398f82,bfef2250,initial andRoc branch,initial andRoc branch,,,,Rocrail,rob@rocbook,Rocrail,rob@rocbook,1271170713,1271170713,
