id,short_id,title,message,additions,deletions,total,author_name,author_email,committer_name,committer_email,authored_date,committed_date,parent_ids
071955c1610e1fb29c65f3f18b6cdaaf593dd1b3,071955c1,connection: disgard socket object on exception -> just try a reconnect,connection: disgard socket object on exception -> just try a reconnect,,,,Rob Versluis,r.j.versluis@rocrail.net,Rob Versluis,r.j.versluis@rocrail.net,1393395244,1393395244,95f941323f32c26f463360005dd4398208f138f0
95f941323f32c26f463360005dd4398208f138f0,95f94132,reconnect: disable connect dialog,reconnect: disable connect dialog,,,,Rob Versluis,r.j.versluis@rocrail.net,Rob Versluis,r.j.versluis@rocrail.net,1393312458,1393312458,88f5de4bdd90997b8aba0b87c60ea9daae62e4f0
88f5de4bdd90997b8aba0b87c60ea9daae62e4f0,88f5de4b,connection recovery every 500ms,connection recovery every 500ms,,,,Rob Versluis,r.j.versluis@rocrail.net,Rob Versluis,r.j.versluis@rocrail.net,1393068170,1393068170,f379c492576ca2970d84f8e4919ad6e0e1e8e665
f379c492576ca2970d84f8e4919ad6e0e1e8e665,f379c492,switch: only use rectangular crossing if addr1 and port1 are zero,switch: only use rectangular crossing if addr1 and port1 are zero,,,,Rob Versluis,r.j.versluis@rocrail.net,Rob Versluis,r.j.versluis@rocrail.net,1389552414,1389552414,5cff201f836ed02b1688895e511c7f4b6589d041
5cff201f836ed02b1688895e511c7f4b6589d041,5cff201f,translation update,translation update,,,,Rob Versluis,r.j.versluis@rocrail.net,Rob Versluis,r.j.versluis@rocrail.net,1387878829,1387878829,60014e3f40a9556688fa82b79e2544bdd846789d
60014e3f40a9556688fa82b79e2544bdd846789d,60014e3f,translation merge,"translation merge
",,,,Rocrail,r.j.versluis@rocrail.net,Rocrail,r.j.versluis@rocrail.net,1387877878,1387877878,0bd5e4f2cccfa4189fd6570dcd4582114eefb673
0bd5e4f2cccfa4189fd6570dcd4582114eefb673,0bd5e4f2,inform all attribute added for system commands,inform all attribute added for system commands,,,,Rob Versluis,r.j.versluis@rocrail.net,Rob Versluis,r.j.versluis@rocrail.net,1386502861,1386502861,c6d7aa4f98ec4c131413d123d410bee19857fbc0
c6d7aa4f98ec4c131413d123d410bee19857fbc0,c6d7aa4f,translation template update,translation template update,,,,rocrail,rocrail@rocrail-ubuntu,rocrail,rocrail@rocrail-ubuntu,1386343420,1386343420,639d2aa5e1f4a0ec95fad3a5e0be50d37adf569d
639d2aa5e1f4a0ec95fad3a5e0be50d37adf569d,639d2aa5,category list: sort roadnames,category list: sort roadnames,,,,Rob Versluis,r.j.versluis@rocrail.net,Rob Versluis,r.j.versluis@rocrail.net,1386336100,1386336100,2e45d3f926997eb1b4b60d3a7898bf259b819a39
2e45d3f926997eb1b4b60d3a7898bf259b819a39,2e45d3f9,category roadname added,category roadname added,,,,Rob Versluis,r.j.versluis@rocrail.net,Rob Versluis,r.j.versluis@rocrail.net,1386329353,1386329353,ad9179fc149c69a3164a6b4d0fff8199d81a6aa5
ad9179fc149c69a3164a6b4d0fff8199d81a6aa5,ad9179fc,category type era added,category type era added,,,,Rob Versluis,r.j.versluis@rocrail.net,Rob Versluis,r.j.versluis@rocrail.net,1386278417,1386278417,df5c507e2cc80d7c9286ea91a841b2fcbbc5cbe4
df5c507e2cc80d7c9286ea91a841b2fcbbc5cbe4,df5c507e,default loco category listview,default loco category listview,,,,Rob Versluis,r.j.versluis@rocrail.net,Rob Versluis,r.j.versluis@rocrail.net,1386193269,1386193269,df6f3e6206acb69eb5ed4f71361dc350f805322a
df6f3e6206acb69eb5ed4f71361dc350f805322a,df6f3e62,use 380 throttle height as default,use 380 throttle height as default,,,,Rob Versluis,r.j.versluis@rocrail.net,Rob Versluis,r.j.versluis@rocrail.net,1385886433,1385886433,03f0fab72567206a83d19ed17482c825b4e064da
03f0fab72567206a83d19ed17482c825b4e064da,03f0fab7,small throttle size width/height option,small throttle size width/height option,,,,Rob Versluis,r.j.versluis@rocrail.net,Rob Versluis,r.j.versluis@rocrail.net,1385841956,1385841956,2f5537351abb0aad84b7a02b2063123e43743e8f
2f5537351abb0aad84b7a02b2063123e43743e8f,2f553735,car show flag,car show flag,,,,r.j.versluis@rocrail.net,,r.j.versluis@rocrail.net,,1379180371,1379180371,055ac254da74c3ff27a980b354db80c7c333f701
055ac254da74c3ff27a980b354db80c7c333f701,055ac254,fix for cars in linear loco list,fix for cars in linear loco list,,,,r.j.versluis@rocrail.net,,r.j.versluis@rocrail.net,,1379151925,1379151925,7e63392b4642aa6b3baa6dc4d7e261a6688803c9
7e63392b4642aa6b3baa6dc4d7e261a6688803c9,7e63392b,fix for building sizes,fix for building sizes,,,,Rob Versluis,r.j.versluis@rocrail.net,Rob Versluis,r.j.versluis@rocrail.net,1376396222,1376396222,5922c96d94e055c50eda6b55de052bed96ea4073
5922c96d94e055c50eda6b55de052bed96ea4073,5922c96d,accessories,accessories,,,,Rob Versluis,r.j.versluis@rocrail.net,Rob Versluis,r.j.versluis@rocrail.net,1376390854,1376390854,88363304ad83b9454490cb54a54fd9621947b6e5
88363304ad83b9454490cb54a54fd9621947b6e5,88363304,staging block initial status,staging block initial status,,,,r.j.versluis@rocrail.net,,r.j.versluis@rocrail.net,,1373873126,1373873126,e0239a3af0641d4ceb21d61fe9211c5f43823883
e0239a3af0641d4ceb21d61fe9211c5f43823883,e0239a3a,sync revision,sync revision,,,,r.j.versluis@rocrail.net,,r.j.versluis@rocrail.net,,1373809110,1373809110,6bc77022c2008c73cc47d48d8e87803fb577d772
6bc77022c2008c73cc47d48d8e87803fb577d772,6bc77022,stageblock update fix,stageblock update fix,,,,r.j.versluis@rocrail.net,,r.j.versluis@rocrail.net,,1373808936,1373808936,689c86b1ef24418ca88135be52f8e9d8a484b71e
689c86b1ef24418ca88135be52f8e9d8a484b71e,689c86b1,missing symbols,missing symbols,,,,rob,,rob,,1372231211,1372231211,1989e8cbb47875393002262a9b0e731316c4aebb
1989e8cbb47875393002262a9b0e731316c4aebb,1989e8cb,missing symbols,missing symbols,,,,rob,,rob,,1372225542,1372225542,ac87abff964a2b2e2abfa80064771aa0faf17de4
ac87abff964a2b2e2abfa80064771aa0faf17de4,ac87abff,fix for updating text image after rotation,fix for updating text image after rotation,,,,r.j.versluis@rocrail.net,,r.j.versluis@rocrail.net,,1370268420,1370268420,3d64282ddce49b5f32679f51f4114468491b4c42
3d64282ddce49b5f32679f51f4114468491b4c42,3d64282d,text image support added,text image support added,,,,r.j.versluis@rocrail.net,,r.j.versluis@rocrail.net,,1370248960,1370248960,4f44b154b7dd6b1ed75324bce4aa43d57a8b5ccf
4f44b154b7dd6b1ed75324bce4aa43d57a8b5ccf,4f44b154,fix for halfauto,fix for halfauto,,,,r.j.versluis@rocrail.net,,r.j.versluis@rocrail.net,,1369232491,1369232491,9f74710e5952a6b48f52f01c630f8f26defde1ff
9f74710e5952a6b48f52f01c630f8f26defde1ff,9f74710e,end loco dlg after action,end loco dlg after action,,,,r.j.versluis@rocrail.net,,r.j.versluis@rocrail.net,,1368964350,1368964350,7b1e0662f2fa9e47864b83dfe6c182e39ba87c57
7b1e0662f2fa9e47864b83dfe6c182e39ba87c57,7b1e0662,fix for goto block,fix for goto block,,,,r.j.versluis@rocrail.net,,r.j.versluis@rocrail.net,,1368953242,1368953242,43638140e2905b07271e2372167af7c8f9b3324e
43638140e2905b07271e2372167af7c8f9b3324e,43638140,remove temp files and sync revision,remove temp files and sync revision,,,,r.j.versluis@rocrail.net,,r.j.versluis@rocrail.net,,1368199701,1368199701,3cf2cb7bae3f24cf29b55b2f42d921913c4c7abd
3cf2cb7bae3f24cf29b55b2f42d921913c4c7abd,3cf2cb7b,"translation update: Chinese, Catalan and Russian added","translation update: Chinese, Catalan and Russian added",,,,r.j.versluis@rocrail.net,,r.j.versluis@rocrail.net,,1368198483,1368198483,df9757a2442e759985a774d3eb8f2f0a00b1065a
df9757a2442e759985a774d3eb8f2f0a00b1065a,df9757a2,sort blocks and schedules,sort blocks and schedules,,,,r.j.versluis@rocrail.net,,r.j.versluis@rocrail.net,,1367958331,1367958331,f78f8a766ca4fb4a44f607115c29d6f0184bd901
f78f8a766ca4fb4a44f607115c29d6f0184bd901,f78f8a76,removed unbinding service at activity stop to avoid a crash,removed unbinding service at activity stop to avoid a crash,,,,r.j.versluis@rocrail.net,,r.j.versluis@rocrail.net,,1367663095,1367663095,69b07f7d5b5d9b0f96a22b6fbec1dea583925f9a
69b07f7d5b5d9b0f96a22b6fbec1dea583925f9a,69b07f7d,new template,new template,,,,Rob Versluis,r.j.versluis@rocrail.net,Rob Versluis,r.j.versluis@rocrail.net,1362896925,1362896925,8093e2d5416001faae20a61f6332712e7be1dba1
8093e2d5416001faae20a61f6332712e7be1dba1,8093e2d5,fix for device rotating,fix for device rotating,,,,r.j.versluis@rocrail.net,,r.j.versluis@rocrail.net,,1362411430,1362411430,2f8b770fa0b73208a5a4071c9624f6bc45525cbf
2f8b770fa0b73208a5a4071c9624f6bc45525cbf,2f8b770f,car support,car support,,,,r.j.versluis@rocrail.net,,r.j.versluis@rocrail.net,,1361710958,1361710958,11831075672a5cf4037f7b10739791e55fdd79ae
11831075672a5cf4037f7b10739791e55fdd79ae,11831075,car support,car support,,,,r.j.versluis@rocrail.net,,r.j.versluis@rocrail.net,,1361706926,1361706926,c638b522e0f15fa3aac36a0a48ee200dfaa8e477
c638b522e0f15fa3aac36a0a48ee200dfaa8e477,c638b522,car support (wip),car support (wip),,,,r.j.versluis@rocrail.net,,r.j.versluis@rocrail.net,,1361706220,1361706220,54daed255721ffdaadc19206244fc367bbaaf2ef
54daed255721ffdaadc19206244fc367bbaaf2ef,54daed25,occupied and route symbol support for signals and switches,occupied and route symbol support for signals and switches,,,,r.j.versluis@rocrail.net,,r.j.versluis@rocrail.net,,1361209528,1361209528,f62c28a33a692a2470ad0fa5cf4d735820be6c7d
f62c28a33a692a2470ad0fa5cf4d735820be6c7d,f62c28a3,route and occupancy symbols,route and occupancy symbols,,,,Rob Versluis,r.j.versluis@rocrail.net,Rob Versluis,r.j.versluis@rocrail.net,1361187272,1361187272,427975464b7de98436706cbd6502b747c3611377
427975464b7de98436706cbd6502b747c3611377,42797546,fix for auto repeat on speed buttons,fix for auto repeat on speed buttons,,,,r.j.versluis@rocrail.net,,r.j.versluis@rocrail.net,,1360999406,1360999406,99a3fdccb8ec725eb5d0031180b30c058e768da6
99a3fdccb8ec725eb5d0031180b30c058e768da6,99a3fdcc,step increment option added,step increment option added,,,,r.j.versluis@rocrail.net,,r.j.versluis@rocrail.net,,1360908862,1360908862,f69a1991af562030833263ed67df2e1a6fd4449c
f69a1991af562030833263ed67df2e1a6fd4449c,f69a1991,button speed control: auto repeat,button speed control: auto repeat,,,,r.j.versluis@rocrail.net,,r.j.versluis@rocrail.net,,1360871896,1360871896,170abc97f58da9ec9e4fb21aace3d67965a77fd4
170abc97f58da9ec9e4fb21aace3d67965a77fd4,170abc97,buttons for speed control option,buttons for speed control option,,,,r.j.versluis@rocrail.net,,r.j.versluis@rocrail.net,,1360866369,1360866369,3ecf1ef2b7b7e30e964444c181f0220ae070c107
3ecf1ef2b7b7e30e964444c181f0220ae070c107,3ecf1ef2,check sensor ID if block was not found,check sensor ID if block was not found,,,,r.j.versluis@rocrail.net,,r.j.versluis@rocrail.net,,1360258089,1360258089,d684369be698d44cbc434c5c3de321c49e13d6d5
d684369be698d44cbc434c5c3de321c49e13d6d5,d684369b,text size adjustment to resemble rocview,text size adjustment to resemble rocview,,,,r.j.versluis@rocrail.net,,r.j.versluis@rocrail.net,,1359904630,1359904630,1ba57c2cc23b35d94f7832c534c89e8483da2443
1ba57c2cc23b35d94f7832c534c89e8483da2443,1ba57c2c,occupied color on enter,occupied color on enter,,,,r.j.versluis@rocrail.net,,r.j.versluis@rocrail.net,,1359888702,1359888702,e89c4b41b90879361440a06da0e126d7a1803111
e89c4b41b90879361440a06da0e126d7a1803111,e89c4b41,more occupied symbols,more occupied symbols,,,,r.j.versluis@rocrail.net,,r.j.versluis@rocrail.net,,1358588756,1358588756,2b0b2b45d1edb08c67ac1bbfc786bc622aa910f4
2b0b2b45d1edb08c67ac1bbfc786bc622aa910f4,2b0b2b45,occupied color for tracks,occupied color for tracks,,,,r.j.versluis@rocrail.net,,r.j.versluis@rocrail.net,,1358583419,1358583419,e8cde4449ec0f4f303d076420e735d17362df2c6
e8cde4449ec0f4f303d076420e735d17362df2c6,e8cde444,guest loco: additional options,guest loco: additional options,,,,r.j.versluis@rocrail.net,,r.j.versluis@rocrail.net,,1358491121,1358491121,6be04662c4e52ca22328ab2001a364dfd51482cb
6be04662c4e52ca22328ab2001a364dfd51482cb,6be04662,address label added in guest dialog,address label added in guest dialog,,,,r.j.versluis@rocrail.net,,r.j.versluis@rocrail.net,,1358456845,1358456845,a5e0a49eefd23aa9651b0df9320ba8c74b9fe2d1
a5e0a49eefd23aa9651b0df9320ba8c74b9fe2d1,a5e0a49e,guest loco option,guest loco option,,,,r.j.versluis@rocrail.net,,r.j.versluis@rocrail.net,,1358452052,1358452052,6ec41b29be20043404cf34b026aaf20af223c245
6ec41b29be20043404cf34b026aaf20af223c245,6ec41b29,fix for TT update: check if the imageview is valid,fix for TT update: check if the imageview is valid,,,,r.j.versluis@rocrail.net,,r.j.versluis@rocrail.net,,1356434687,1356434687,8246329e81de4d997581fbccd57c9f0373d10d54
8246329e81de4d997581fbccd57c9f0373d10d54,8246329e,modified curved connection symbols to match with Rocview,modified curved connection symbols to match with Rocview,,,,Rob Versluis,r.j.versluis@rocrail.net,Rob Versluis,r.j.versluis@rocrail.net,1356433519,1356433519,f497e00af08c844ddb9d16d5e7ddbe4e6195b252
f497e00af08c844ddb9d16d5e7ddbe4e6195b252,f497e00a,orientation fix for curved connectors,orientation fix for curved connectors,,,,r.j.versluis@rocrail.net,,r.j.versluis@rocrail.net,,1355039370,1355039370,11ac8dc2763c958db6d651d5e6f685aa808e9e65
11ac8dc2763c958db6d651d5e6f685aa808e9e65,11ac8dc2,connector curved type added,connector curved type added,,,,r.j.versluis@rocrail.net,,r.j.versluis@rocrail.net,,1355037255,1355037255,4f6c5d76656335a8efb1410aab8eb0365d9093a2
4f6c5d76656335a8efb1410aab8eb0365d9093a2,4f6c5d76,LEDButton look and feel,LEDButton look and feel,,,,jmf@polygonpunkt.de,,jmf@polygonpunkt.de,,1354529851,1354529851,903d983721b649d8f394eb4eedb2cc8d95965615
903d983721b649d8f394eb4eedb2cc8d95965615,903d9837,fix for initial loading external symbols (roger),fix for initial loading external symbols (roger),,,,r.j.versluis@rocrail.net,,r.j.versluis@rocrail.net,,1354254011,1354254011,08467f358213a5eaf6ba0a5eb97a22b0abf76469
08467f358213a5eaf6ba0a5eb97a22b0abf76469,08467f35,Fix for symbol orientation in case of modular layout.,Fix for symbol orientation in case of modular layout.,,,,r.j.versluis@rocrail.net,,r.j.versluis@rocrail.net,,1350490711,1350490711,712174fed529e1dceebb26988966e308ca041173
712174fed529e1dceebb26988966e308ca041173,712174fe,disable switch to master on clicking the consist line,disable switch to master on clicking the consist line,,,,r.j.versluis@rocrail.net,,r.j.versluis@rocrail.net,,1350402123,1350402123,05811e43300f88acaa37a55e4569e920d98f0aab
05811e43300f88acaa37a55e4569e920d98f0aab,05811e43,fix for function icons,fix for function icons,,,,r.j.versluis@rocrail.net,,r.j.versluis@rocrail.net,,1348219127,1348219127,caa3fb96baf0cf012a6c2016bee7afa9e79eeb80
caa3fb96baf0cf012a6c2016bee7afa9e79eeb80,caa3fb96,icon for function 0,icon for function 0,,,,r.j.versluis@rocrail.net,,r.j.versluis@rocrail.net,,1348217394,1348217394,830d53445fd757e477c3200684e6d64ac37df32f
830d53445fd757e477c3200684e6d64ac37df32f,830d5344,remove function button text in case an icon is available,remove function button text in case an icon is available,,,,r.j.versluis@rocrail.net,,r.j.versluis@rocrail.net,,1347892067,1347892067,e8c92fdb3dbff9e73197ee5782e79560602652e7
e8c92fdb3dbff9e73197ee5782e79560602652e7,e8c92fdb,function icons support,function icons support,,,,r.j.versluis@rocrail.net,,r.j.versluis@rocrail.net,,1347878555,1347878555,56af1c402c5b9868070ace1611ab85d9e0ac72d6
56af1c402c5b9868070ace1611ab85d9e0ac72d6,56af1c40,long click on direction of a consist slave will switch to the master,long click on direction of a consist slave will switch to the master,,,,r.j.versluis@rocrail.net,,r.j.versluis@rocrail.net,,1347562118,1347562118,17c1225e82d2cc69aa6ce43466a028f9333786ff
17c1225e82d2cc69aa6ce43466a028f9333786ff,17c1225e,consist: click on master line to switch to master loco in throttle,consist: click on master line to switch to master loco in throttle,,,,r.j.versluis@rocrail.net,,r.j.versluis@rocrail.net,,1347560898,1347560898,c5d0924bb1f8d5811b10a0da0ea969a73888e0da
c5d0924bb1f8d5811b10a0da0ea969a73888e0da,c5d0924b,show master of consist,show master of consist,,,,r.j.versluis@rocrail.net,,r.j.versluis@rocrail.net,,1347553565,1347553565,a3c83d76969e8fb8853b9df6a42da44f64d4b475
a3c83d76969e8fb8853b9df6a42da44f64d4b475,a3c83d76,Fix for staging block dialog text.,Fix for staging block dialog text.,,,,r.j.versluis@rocrail.net,,r.j.versluis@rocrail.net,,1347374546,1347374546,d45991ae76b772b253aefee4a9e278f1b0e48521
d45991ae76b772b253aefee4a9e278f1b0e48521,d45991ae,stagingblock support,stagingblock support,,,,r.j.versluis@rocrail.net,,r.j.versluis@rocrail.net,,1347289815,1347289815,3ce40b7b596f69ed8da9d512f6dba0b488b88f04
3ce40b7b596f69ed8da9d512f6dba0b488b88f04,3ce40b7b,added more route symbols,added more route symbols,,,,r.j.versluis@rocrail.net,,r.j.versluis@rocrail.net,,1346956336,1346956336,9320b662ba74c4dda53f164c69a3b6905be354aa
9320b662ba74c4dda53f164c69a3b6905be354aa,9320b662,fix for velocity update incase of consists,"fix for velocity update incase of consists
fix for accessory on/off
start of showing routes",,,,r.j.versluis@rocrail.net,,r.j.versluis@rocrail.net,,1346944150,1346944150,f55d733aef68021e0c32be1654a799f8e7453b25
f55d733aef68021e0c32be1654a799f8e7453b25,f55d733a,show loco placing in list,show loco placing in list,,,,r.j.versluis@rocrail.net,,r.j.versluis@rocrail.net,,1343218958,1343218958,3da2e61ec89aac87cd273c9b7f3a06b2dd0cf677
3da2e61ec89aac87cd273c9b7f3a06b2dd0cf677,3da2e61e,open loco settings from the consist list,open loco settings from the consist list,,,,r.j.versluis@rocrail.net,,r.j.versluis@rocrail.net,,1343210096,1343210096,a23570cdb1d8fdaf9afd7ecbb070d9e3e8f927ec
a23570cdb1d8fdaf9afd7ecbb070d9e3e8f927ec,a23570cd,added consist text line,added consist text line,,,,r.j.versluis@rocrail.net,,r.j.versluis@rocrail.net,,1343210051,1343210051,f92508f00534085d0ca191914faf40ae14273b9b
f92508f00534085d0ca191914faf40ae14273b9b,f92508f0,version code sync,version code sync,,,,r.j.versluis@rocrail.net,,r.j.versluis@rocrail.net,,1343194075,1343194075,7592303f15f7ea838207d3d77bc38c1c7be191c0
7592303f15f7ea838207d3d77bc38c1c7be191c0,7592303f,exclude consist members from selection list for adding,exclude consist members from selection list for adding,,,,r.j.versluis@rocrail.net,,r.j.versluis@rocrail.net,,1343194030,1343194030,0a83d2bda7824076996dda3d49be110726555103
0a83d2bda7824076996dda3d49be110726555103,0a83d2bd,new translation template,new translation template,,,,r.j.versluis@rocrail.net,,r.j.versluis@rocrail.net,,1343154952,1343154952,c00bc25b411c5214a1912676c2f749710aeab4e8
c00bc25b411c5214a1912676c2f749710aeab4e8,c00bc25b,fix for deleting first consist member,fix for deleting first consist member,,,,r.j.versluis@rocrail.net,,r.j.versluis@rocrail.net,,1343154753,1343154753,2fba3e16da0d7e0c6035a989ece35b2d7576ca96
2fba3e16da0d7e0c6035a989ece35b2d7576ca96,2fba3e16,manage consist on long clicking direction button,manage consist on long clicking direction button,,,,r.j.versluis@rocrail.net,,r.j.versluis@rocrail.net,,1343154625,1343154625,db12d12c786c7721281f5ee75f43447800f30ebb
db12d12c786c7721281f5ee75f43447800f30ebb,db12d12c,fix for crashing on an empty plan,fix for crashing on an empty plan,,,,r.j.versluis@rocrail.net,,r.j.versluis@rocrail.net,,1343135219,1343135219,c09e17ce52f327b1e1ce304c337b3a10e782717f
c09e17ce52f327b1e1ce304c337b3a10e782717f,c09e17ce,Fix for curved sensor,Fix for curved sensor,,,,r.j.versluis@rocrail.net,,r.j.versluis@rocrail.net,,1343109873,1343109873,9b9f7459109d8efe093b7d0a158ca3c6a268d03e
9b9f7459109d8efe093b7d0a158ca3c6a268d03e,9b9f7459,zoom option and fix for empty function text,zoom option and fix for empty function text,,,,r.j.versluis@rocrail.net,,r.j.versluis@rocrail.net,,1342625629,1342625629,eaa1e071bae6e50ac506ecd51ab4b7db9a6ba86a
eaa1e071bae6e50ac506ecd51ab4b7db9a6ba86a,eaa1e071,5 minutes demo credit,5 minutes demo credit,,,,r.j.versluis@rocrail.net,,r.j.versluis@rocrail.net,,1341740631,1341740631,8e4f84a763440b1a4e393735f273664a547f7416
8e4f84a763440b1a4e393735f273664a547f7416,8e4f84a7,show sensor shortcut status,show sensor shortcut status,,,,r.j.versluis@rocrail.net,,r.j.versluis@rocrail.net,,1339938321,1339938321,8cffb0a34bb0c4884a768e1888a6da04875dae72
8cffb0a34bb0c4884a768e1888a6da04875dae72,8cffb0a3,menu icons with white background and rounded corners,menu icons with white background and rounded corners,,,,r.j.versluis@rocrail.net,,r.j.versluis@rocrail.net,,1339867750,1339867750,e8f1da71ea6c356d833a124334beef8223503018
e8f1da71ea6c356d833a124334beef8223503018,e8f1da71,force speed command on lights and direction change,force speed command on lights and direction change,,,,r.j.versluis@rocrail.net,,r.j.versluis@rocrail.net,,1338557868,1338557868,a3ea5cff2b9f581dc4d4dd23e75599be3f68af83
a3ea5cff2b9f581dc4d4dd23e75599be3f68af83,a3ea5cff,999839: only send speed command on change,999839: only send speed command on change,,,,r.j.versluis@rocrail.net,,r.j.versluis@rocrail.net,,1337107519,1337107519,a4cbbcf6ffb70bdca46e1470a69859e1f1ab9da3
a4cbbcf6ffb70bdca46e1470a69859e1f1ab9da3,a4cbbcf6,sync throttle speed option,sync throttle speed option,,,,r.j.versluis@rocrail.net,,r.j.versluis@rocrail.net,,1337094989,1337094989,65ab71a42a0fee992bbd70d4f124d7b5236ebcd0
65ab71a42a0fee992bbd70d4f124d7b5236ebcd0,65ab71a4,996932: throttle slider resolution option added for full 128 speed steps,996932: throttle slider resolution option added for full 128 speed steps,,,,r.j.versluis@rocrail.net,,r.j.versluis@rocrail.net,,1336574683,1336574683,62a9c2ceb7bf7b4263925c8358442b46755984f2
62a9c2ceb7bf7b4263925c8358442b46755984f2,62a9c2ce,cv menu added in case of active throttle,cv menu added in case of active throttle,,,,r.j.versluis@rocrail.net,,r.j.versluis@rocrail.net,,1334486269,1334486269,2ffe6263a472e5371f1eeca87890f3de89c97bfe
2ffe6263a472e5371f1eeca87890f3de89c97bfe,2ffe6263,fix for POM write,fix for POM write,,,,r.j.versluis@rocrail.net,,r.j.versluis@rocrail.net,,1332784615,1332784615,36f5781761796c7102966445afad66dc02b9145c
36f5781761796c7102966445afad66dc02b9145c,36f57817,twoway switch type added,twoway switch type added,,,,r.j.versluis@rocrail.net,,r.j.versluis@rocrail.net,,1331995215,1331995215,73be581a00d50048555b5db4b23b499cd18b43fb
73be581a00d50048555b5db4b23b499cd18b43fb,73be581a,androc: fix for loco selection,androc: fix for loco selection,,,,r.j.versluis@rocrail.net,,r.j.versluis@rocrail.net,,1330784485,1330784485,d449d4adaea1b9ea57bd74404abb5fbeaf6bd5a8
d449d4adaea1b9ea57bd74404abb5fbeaf6bd5a8,d449d4ad,androc: fix for loco selection in case of invisible entries,androc: fix for loco selection in case of invisible entries,,,,r.j.versluis@rocrail.net,,r.j.versluis@rocrail.net,,1330696408,1330696408,d4934b73cfc0dc282f3c15ebe7e043bed3558d50
d4934b73cfc0dc282f3c15ebe7e043bed3558d50,d4934b73,using GT/LT signes for direction instead of LED,using GT/LT signes for direction instead of LED,,,,r.j.versluis@rocrail.net,,r.j.versluis@rocrail.net,,1324276686,1324276686,971b3420b5e56b4069fb54dcd1f51f3c06e2efdb
971b3420b5e56b4069fb54dcd1f51f3c06e2efdb,971b3420,update translation: nl,update translation: nl,,,,r.j.versluis@rocrail.net,,r.j.versluis@rocrail.net,,1322722623,1322722623,540c1e1c757d08505bcdd4d0cb55a4a6579f7543
540c1e1c757d08505bcdd4d0cb55a4a6579f7543,540c1e1c,"translation update: de,nl,sv","translation update: de,nl,sv",,,,r.j.versluis@rocrail.net,,r.j.versluis@rocrail.net,,1322722078,1322722078,3e3257609612a120f01ffbbe36bcc29cbf4562e8
3e3257609612a120f01ffbbe36bcc29cbf4562e8,3e325760,update info,update info,,,,r.j.versluis@rocrail.net,,r.j.versluis@rocrail.net,,1322593840,1322593840,d95f68b8219f8fbe787a9213ffe0a9675cbf5a01
d95f68b8219f8fbe787a9213ffe0a9675cbf5a01,d95f68b8,fix for acceptident,fix for acceptident,,,,rob,,rob,,1321472562,1321472562,b02793259dbab66c77f7d816a24d3c5e3cd8b000
b02793259dbab66c77f7d816a24d3c5e3cd8b000,b0279325,fix for show flag,fix for show flag,,,,rob,,rob,,1321023357,1321023357,69b8892e6975c12f9ed466ded9851e4766a06402
69b8892e6975c12f9ed466ded9851e4766a06402,69b8892e,show flag added in loco object for use in lists,show flag added in loco object for use in lists,,,,rob,,rob,,1320405955,1320405955,062b95a08bfafb945d38bc9dbaca6091317199c3
062b95a08bfafb945d38bc9dbaca6091317199c3,062b95a0,fix for commuter train type for extended list,fix for commuter train type for extended list,,,,rob,,rob,,1320153254,1320153254,d0f2b55d80951ed17924b09f923188fc0b67367b
d0f2b55d80951ed17924b09f923188fc0b67367b,d0f2b55d,androc: set default result to -1 for no selection,androc: set default result to -1 for no selection,,,,rob,,rob,,1319468687,1319468687,ca7cbeb597c2aeb8dff0fd995228a6f6c74d82e2
ca7cbeb597c2aeb8dff0fd995228a6f6c74d82e2,ca7cbeb5,androc: loco list by category,androc: loco list by category,,,,rob,,rob,,1319468354,1319468354,b79c640a1a9e8e5709826c1873e425be4bc6ec52
b79c640a1a9e8e5709826c1873e425be4bc6ec52,b79c640a,train categories: WIP,train categories: WIP,,,,rob,,rob,,1319382808,1319382808,813062922eb9f6d49ae86e24a403dc9b4eb25b39
813062922eb9f6d49ae86e24a403dc9b4eb25b39,81306292,train categories: WIP,train categories: WIP,,,,rob,,rob,,1319381347,1319381347,1b4234f86877ef0eb3b4bbeecd8bd1da2e79ffb8
1b4234f86877ef0eb3b4bbeecd8bd1da2e79ffb8,1b4234f8,long click on loco activity start for gotoblock,long click on loco activity start for gotoblock,,,,rob,,rob,,1318968110,1318968110,074c067fbab99cba852dd120a99b180cb83f12d9
074c067fbab99cba852dd120a99b180cb83f12d9,074c067f,text for function 0 added in throttle,text for function 0 added in throttle,,,,rob,,rob,,1318950361,1318950361,9ac79d470af4075b214c4b63315dcb72d176fdfd
9ac79d470af4075b214c4b63315dcb72d176fdfd,9ac79d47,"external symbols option ""/sdcard/androc/symbols/*.png""","external symbols option ""/sdcard/androc/symbols/*.png""",,,,rob,,rob,,1318572396,1318572396,c0e6719f51ef6c44dc716ce2cb6964f9ef425e73
c0e6719f51ef6c44dc716ce2cb6964f9ef425e73,c0e6719f,update background color on the fly,update background color on the fly,,,,rob,,rob,,1317971141,1317971141,da8d37c48b6d6e0a12971b60e2a8c38fa99bfb9f
da8d37c48b6d6e0a12971b60e2a8c38fa99bfb9f,da8d37c4,typo corrected,typo corrected,,,,rob,,rob,,1317893300,1317893300,141bed34c75afb43cf3f97c190ba107c82a77d76
