id,short_id,title,message,additions,deletions,total,author_name,author_email,committer_name,committer_email,authored_date,committed_date,parent_ids
ca34e3b454201cb5a1c4c6dad313ee74087ac4c9,ca34e3b4,Added video,"Added video
",,,,Jorge Alvaro,jorge.alvaro@buongiorno.com,Jorge Alvaro,jorge.alvaro@buongiorno.com,1460227089,1460227089,4b4869df9ed084dcb950816b86ecaa11acb98a9d
4b4869df9ed084dcb950816b86ecaa11acb98a9d,4b4869df,Updated readme,"Updated readme
",,,,Jorge Alvaro,jorge.alvaro@buongiorno.com,Jorge Alvaro,jorge.alvaro@buongiorno.com,1460226694,1460226694,9d0f4ffbaf1f65df427f6b4d7b9929c1d473d2da
9d0f4ffbaf1f65df427f6b4d7b9929c1d473d2da,9d0f4ffb,Added MIT license. Include a link to @jorgelamb if you use this,"Added MIT license. Include a link to @jorgelamb if you use this
",,,,Jorge Alvaro,jorge.alvaro@buongiorno.com,Jorge Alvaro,jorge.alvaro@buongiorno.com,1460226556,1460226556,b5e88e42312ba8ed2e925834486d12c8a11c22eb
b5e88e42312ba8ed2e925834486d12c8a11c22eb,b5e88e42,Bottle Top Race game in your Android!,"Bottle Top Race game in your Android!

Available at https://play.google.com/store/apps/details?id=com.lamboratory.android.bottleTop.race

Original control method: Play this racing game by hitting your phone like a bottle top. Click on the screen to point and hit your phone with your finger. The harder you hit, the longer the shot. Watch the video to see it in action.

Multiplayer game in one Android phone. Unlimited number of players.
Try to be the first to get to the finish line to win the race.
Multiple tracks available. Train in the basic circuit or compete with your friends in the complex circuit.
Select the number of laps to complete the race.
Realistic controls, just like playing with a bottle cap.
Apps2SD enabled, you can move it to the SD card. Don't worry about the space it takes.

This is a free game, with no annoying ads. If you like the game rate it in the Android Market and consider making a donation from inside the game with in-app billing ;)

Available in English and Spanish (Carreras de chapas). Contact us if you can translate it to any other language.

Your feedback is welcome. Add your comments in the Android Market or send them to the email address listed there. We want to keep improving our games!

Note: We are not responsible if you hit your phone too hard and break it, or if you hurt your finger :p
",,,,Jorge Alvaro,jorge.alvaro@buongiorno.com,Jorge Alvaro,jorge.alvaro@buongiorno.com,1460226352,1460226352,486a72cf6ecf839b1b3d7fcc5d1fcc5a06fd34ec
486a72cf6ecf839b1b3d7fcc5d1fcc5a06fd34ec,486a72cf,Initial commit,Initial commit,,,,Jorge Alvaro,jorgealvaro+github@gmail.com,Jorge Alvaro,jorgealvaro+github@gmail.com,1460226162,1460226162,
