id,short_id,title,message,additions,deletions,total,author_name,author_email,committer_name,committer_email,authored_date,committed_date,parent_ids
df31a1469f7fb00522f95350b4bad4baf6700a4e,df31a146,Add explicit support for all screen size classes.,"Add explicit support for all screen size classes.
",,,,Brendan Jurd,direvus@gmail.com,Brendan Jurd,direvus@gmail.com,1488001510,1488001510,62d1fa5941e66ae2fe28139f5e52f7b0173570c9
62d1fa5941e66ae2fe28139f5e52f7b0173570c9,62d1fa59,Bump to version 2.5.,"Bump to version 2.5.
",,,,Brendan Jurd,direvus@gmail.com,Brendan Jurd,direvus@gmail.com,1487997544,1487997544,a9820e1a507714c641e630bcef6e0e928c67f19a
a9820e1a507714c641e630bcef6e0e928c67f19a,a9820e1a,Move common layout elements into re-usable layouts for inclusion.,"Move common layout elements into re-usable layouts for inclusion.

This removes nearly all of the duplication between layout/main and
layout-sw600dp/main.
",,,,Brendan Jurd,direvus@gmail.com,Brendan Jurd,direvus@gmail.com,1487997458,1487997458,8727902b39d73b85a4b1bb2f2bffdfc780015cba
8727902b39d73b85a4b1bb2f2bffdfc780015cba,8727902b,Apply thumbs icon to tablet layout.,"Apply thumbs icon to tablet layout.
",,,,Brendan Jurd,direvus@gmail.com,Brendan Jurd,direvus@gmail.com,1487985761,1487985761,6f5bacc52466e6804e61e14c081578f244107efa
6f5bacc52466e6804e61e14c081578f244107efa,6f5bacc5,Bump to version 2.4.,"Bump to version 2.4.
",,,,Brendan Jurd,direvus@gmail.com,Brendan Jurd,direvus@gmail.com,1487900929,1487900929,e01e109535fe08fdd00035772d610b02a9197ac2
e01e109535fe08fdd00035772d610b02a9197ac2,e01e1095,Add defense against null pointer exceptions in mLogFragment.,"Add defense against null pointer exceptions in mLogFragment.

There are some circumstances (possibly only while debugging) where the
code attempts to modify the results log table before the log fragment
has populated its reference to the table into its mLog variable.

For good measure I also added some protections against the mLogFragment
pointer being null.
",,,,Brendan Jurd,direvus@gmail.com,Brendan Jurd,direvus@gmail.com,1487900684,1487900684,c4ad228b1afe03e94de71fb7a933821723322eb1
c4ad228b1afe03e94de71fb7a933821723322eb1,c4ad228b,Add icons for minimum and maximum results.,"Add icons for minimum and maximum results.

Alongside the primary result text, there is a thumbs-down icon to the
left, and a thumbs-up icon to the right.  Both icons are initially
invisible.

On each roll, if the result matches the lowest possible result of the
roll, we show the thumbs-down icon.  Likewise, if it matches the highest
possible roll, we show the thumbs-up icon.  The intention is to draw the
user's attention to results that might trigger some special rule
(critical success or critical failure).
",,,,Brendan Jurd,direvus@gmail.com,Brendan Jurd,direvus@gmail.com,1487900522,1487900522,aaf6ae487259fae979849248f1993fb77444d163
aaf6ae487259fae979849248f1993fb77444d163,aaf6ae48,"Don't bother ""rolling"" static configurations.","Don't bother ""rolling"" static configurations.

If the configuration is bounded, and its minimum result is the same as
its maximum result, then it is a fixed outcome, and there is no point in
rolling it.
",,,,Brendan Jurd,direvus@gmail.com,Brendan Jurd,direvus@gmail.com,1487898282,1487898282,f03a499a6fb0ed5ed020e32f0270cf2c9d03fcac
f03a499a6fb0ed5ed020e32f0270cf2c9d03fcac,f03a499a,Fix table layout of dice counter UI.,"Fix table layout of dice counter UI.

Turns out that I had been doing this wrong the whole time.
Instantiating a class that extends from TableRow, and inflating an XML
layout into it which has a TableRow root node actually yields a TableRow
inside another TableRow.

The correct approach for a situation like this is to use a <merge> node
as the root node of the XML, which actually collapses to be no node at
all once it is inflated.

Also, add a little ""d"" label in front of the dX sides input, to
hopefully make it more clear what these inputs do.
",,,,Brendan Jurd,direvus@gmail.com,Brendan Jurd,direvus@gmail.com,1487897547,1487897547,76ad45a305dbea64f1078bd34aa5c4f3a179d264
76ad45a305dbea64f1078bd34aa5c4f3a179d264,76ad45a3,Allow for negative dice counts.,"Allow for negative dice counts.

When a dice count is negative, it means to roll the (absolute value)
number of dice, and subtract each result from the total instead of
adding each result.

The logic was mostly already set up to handle this correctly, although I
did have to correct one oversight in ThirdActivity.rollDie().  Apart
from that, it was just a matter of amending the inputType on the counter
inputs from ""number"" to ""numberSigned"".
",,,,Brendan Jurd,direvus@gmail.com,Brendan Jurd,direvus@gmail.com,1487893329,1487893329,e6bba2eeb00ee16a5358c07e7ea094305e3198ef
e6bba2eeb00ee16a5358c07e7ea094305e3198ef,e6bba2ee,Fix bug in description of dX configurations.,"Fix bug in description of dX configurations.

In ThirdConfig.describe(), I had the arguments mDx and mDxSides around
the wrong way for describeDie(), so a configuration with one d3 would
roll correctly, but show as ""3d1"" in the config description.
",,,,Brendan Jurd,direvus@gmail.com,Brendan Jurd,direvus@gmail.com,1487891646,1487891646,4d98d1ce51026bdf176cbc78e16951c498526d0c
4d98d1ce51026bdf176cbc78e16951c498526d0c,4d98d1ce,Fix logic for preset context menu.,"Fix logic for preset context menu.

I had mistakenly applied the rule that the ""Include other preset"" option
be disabled if there is only one preset to the wrong menu item.
",,,,Brendan Jurd,direvus@gmail.com,Brendan Jurd,direvus@gmail.com,1487891417,1487891417,9ff9c7c448beb1ed372a026d61f4168daea4dccb
9ff9c7c448beb1ed372a026d61f4168daea4dccb,9ff9c7c4,Bump to version 2.3.,"Bump to version 2.3.
",,,,Brendan Jurd,direvus@gmail.com,Brendan Jurd,direvus@gmail.com,1487863358,1487863358,a87a3783b665e3a9e8e7383104a15c2d12319e50
a87a3783b665e3a9e8e7383104a15c2d12319e50,a87a3783,Fix coding error in resolving inclusions.,"Fix coding error in resolving inclusions.

For some daft reason I thought that it would make sense to use a
SparseIntArray to hold the relationships between presets and their
inclusions.  The problem is that when you have multiple inclusions for
one preset, they clobber each other, because SparseIntArray is a map.

What I actually needed here was either a list of (int, int) tuples, or a
map of int -> a list of ints.  I went with a list of (int, int) tuples
for simplicity.
",,,,Brendan Jurd,direvus@gmail.com,Brendan Jurd,direvus@gmail.com,1487863143,1487863143,724e1b15bb5d946e7293a34d1ec325878342c95f
724e1b15bb5d946e7293a34d1ec325878342c95f,724e1b15,Add alternate layout for tablet screens.,"Add alternate layout for tablet screens.

For devices with a shortest width of at least 600dp, I render an
alternate layout which includes both the Presets and Results fragments
side-by-side, rather than in a view pager.
",,,,Brendan Jurd,direvus@gmail.com,Brendan Jurd,direvus@gmail.com,1487861647,1487861647,c45e0bfbd983376baa5df90353c0e9e1152d6bbd
c45e0bfbd983376baa5df90353c0e9e1152d6bbd,c45e0bfb,Update to latest version 25.2.0 of appcompat v7.,"Update to latest version 25.2.0 of appcompat v7.
",,,,Brendan Jurd,direvus@gmail.com,Brendan Jurd,direvus@gmail.com,1487831084,1487831084,9f7b9b7f831597d17b02550fd8b030f51bbafcff
9f7b9b7f831597d17b02550fd8b030f51bbafcff,9f7b9b7f,Remove unused import.,"Remove unused import.
",,,,Brendan Jurd,direvus@gmail.com,Brendan Jurd,direvus@gmail.com,1487830910,1487830910,91fd511800ff881cd4f487e10a42da5e2737d7c1
91fd511800ff881cd4f487e10a42da5e2737d7c1,91fd5118,Use the standard button bar style for Clear and Roll buttons.,"Use the standard button bar style for Clear and Roll buttons.

Another helpful suggestion from Android Lint.
",,,,Brendan Jurd,direvus@gmail.com,Brendan Jurd,direvus@gmail.com,1487830884,1487830884,c837562ca515207315053a756b42db7d2246b03b
c837562ca515207315053a756b42db7d2246b03b,c837562c,Use a view pager instead of a view flipper with radios.,"Use a view pager instead of a view flipper with radios.

In the phone layout, in order to switch between showing the profile/presets and the results details in the right-hand pane, I had previously used a ViewFlipper controlled by a pair of radio buttons.

That's an ugly and outdated approach.  The modern way to achieve this is
to make each of the switchable views into Fragments, and to switch
between them using a ViewPager, which is much more visually intuitive
and, as an added bonus, supports swipe gestures.

Further, now that the views are set up as Fragments, I can produce an
alternate layout for tablets that includes both fragments side-by-side,
with no need to switch between them.
",,,,Brendan Jurd,direvus@gmail.com,Brendan Jurd,direvus@gmail.com,1487830666,1487830666,3dd0c27ba05a9b33dfcd731701a5cd87d8f722c4
3dd0c27ba05a9b33dfcd731701a5cd87d8f722c4,3dd0c27b,Remove feature graphic from drawable resources.,"Remove feature graphic from drawable resources.

Since this graphic is only used on the Play store listing, it's not
appropriate to have it in drawables, which is only for graphics that
will be used by the application.
",,,,Brendan Jurd,direvus@gmail.com,Brendan Jurd,direvus@gmail.com,1487819888,1487819888,7e01b363681ca2d19e936ff861fbb5b9e55349f1
7e01b363681ca2d19e936ff861fbb5b9e55349f1,7e01b363,Replace hyphen with en dash for numeric range.,"Replace hyphen with en dash for numeric range.

Per suggestion from Android Lint.  Nice one, Lint.
",,,,Brendan Jurd,direvus@gmail.com,Brendan Jurd,direvus@gmail.com,1487818731,1487818731,6db595c546267f261a3375e9958f6dd0efbf09cf
6db595c546267f261a3375e9958f6dd0efbf09cf,6db595c5,Remove unused layout definition add_inc.xml.,"Remove unused layout definition add_inc.xml.

This was previously used as the layout for the activity to choose
another preset to include in the current preset, but that activity has
since been replaced by a dialog.
",,,,Brendan Jurd,direvus@gmail.com,Brendan Jurd,direvus@gmail.com,1487816492,1487816509,2d5b5ba197c8095266ce763e3fe62bc11c1ecb2b
2d5b5ba197c8095266ce763e3fe62bc11c1ecb2b,2d5b5ba1,Begin work on supporting multiple screen sizes.,"Begin work on supporting multiple screen sizes.

In this commit, I have generated drawable resources for my various icons
targetting all of the standard screen densities, switched to using a
mipmap for the application launcher icon (so that devices can use a
larger icon for launchers if they wish) and allowed the application to
rotate into landscape mode.
",,,,Brendan Jurd,direvus@gmail.com,Brendan Jurd,direvus@gmail.com,1487762444,1487762444,c0baacf17a093fa752fa4271204fe5cdb8ea5f32
c0baacf17a093fa752fa4271204fe5cdb8ea5f32,c0baacf1,Bump to version 2.2.,"Bump to version 2.2.
",,,,Brendan Jurd,direvus@gmail.com,Brendan Jurd,direvus@gmail.com,1487689350,1487689350,71161146db333984ba909ec6915ad6f74169e438
71161146db333984ba909ec6915ad6f74169e438,71161146,Apply custom theme on top of AppCompat.Light.NoActionBar.,"Apply custom theme on top of AppCompat.Light.NoActionBar.

I am using a theme based on the Material Indigo colour palette.  I had
originally intended to use a dark colour for the app bar, but had
difficulty figuring out how to get Android to automatically render the
menu icons in the appropriate colour (they were showing as black over a
dark background).  Perhaps something to try another time.
",,,,Brendan Jurd,direvus@gmail.com,Brendan Jurd,direvus@gmail.com,1487689025,1487689025,a7f7650012fb1d1be675a71e4ba96cf835fe4962
a7f7650012fb1d1be675a71e4ba96cf835fe4962,a7f76500,Add UI to add triggers to presets.,"Add UI to add triggers to presets.
",,,,Brendan Jurd,direvus@gmail.com,Brendan Jurd,direvus@gmail.com,1487687800,1487687800,004dc1e9963d32967697ef143bf631d8f96fa5f8
004dc1e9963d32967697ef143bf631d8f96fa5f8,004dc1e9,Add utility method for making primitive int arrays.,"Add utility method for making primitive int arrays.

In another astounding feat of unhelpfulness, Java has no built-in way of
getting a primitive array of integers out of a Collection of Integers.
I figure this isn't the only time I'm going to need this, so I made a
method in ThirdUtil.
",,,,Brendan Jurd,direvus@gmail.com,Brendan Jurd,direvus@gmail.com,1487683195,1487683195,0063216a9698b46e64463c2f1a8b7b0005d5a16b
0063216a9698b46e64463c2f1a8b7b0005d5a16b,0063216a,Save/restore instance state with current configuration as JSON.,"Save/restore instance state with current configuration as JSON.

This means that if the activity is killed and restarted by the OS, it
will retain the entire roll configuration, including the name,
inclusions and triggers.  Previously we just put the current value of
the major inputs into saved state, which didn't really make sense, since
the superclass automatically saves and restores the content of all the
inputs in the layout.  The job of my subclass methods is to make sure
that my custom variables (like mConfig) are correctly re-populated.
",,,,Brendan Jurd,direvus@gmail.com,Brendan Jurd,direvus@gmail.com,1487659953,1487659953,be656f5ff330139c729fcb9aed559da8c90e31d1
be656f5ff330139c729fcb9aed559da8c90e31d1,be656f5f,Add initial code to support dice roll triggers.,"Add initial code to support dice roll triggers.

The triggers mechanism is intended to allow for more complex roll
algorithms like ""exploding"" dice (rolling again on certain results, and
adding the new result) and ""(dis)advantage"" (rolling again and taking
the lesser/greater of the two rolls).

I have written up the first pass of logic for the triggers, but not any
UI to add or remove them from roll configurations in the app.
",,,,Brendan Jurd,direvus@gmail.com,Brendan Jurd,direvus@gmail.com,1487572444,1487572444,56bd6f5cbe6b5844efb76d693b6dcbd51298fe11
56bd6f5cbe6b5844efb76d693b6dcbd51298fe11,56bd6f5c,Convert README into Markdown syntax.,"Convert README into Markdown syntax.

Also, add mention of the Android app here.
",,,,Brendan Jurd,direvus@gmail.com,Brendan Jurd,direvus@gmail.com,1487487676,1487487676,86c319ce7b0437ffcad4e1fad7d2066922c65d08
86c319ce7b0437ffcad4e1fad7d2066922c65d08,86c319ce,Add convenience method to get the current profile.,"Add convenience method to get the current profile.
",,,,Brendan Jurd,direvus@gmail.com,Brendan Jurd,direvus@gmail.com,1487487095,1487487095,0b5c239dc07a47c1a6d34c893193612d5e62ce1c
0b5c239dc07a47c1a6d34c893193612d5e62ce1c,0b5c239d,Set values for mId and mName in the ThirdConfig declarations.,"Set values for mId and mName in the ThirdConfig declarations.
",,,,Brendan Jurd,direvus@gmail.com,Brendan Jurd,direvus@gmail.com,1487486279,1487486279,6f029a0ac4c656898be55cd30997ca7d0c2c679b
6f029a0ac4c656898be55cd30997ca7d0c2c679b,6f029a0a,Drop java.util.Random for Math.random().,"Drop java.util.Random for Math.random().

The difference is that Math.random() instantiates a new java.util.Random
object every time you call it, so you're drawing random results from
different seeds each time.  Using the same Random object for the life of
the application means that if somebody could work out which seed you
were using, they could predict the results.
",,,,Brendan Jurd,direvus@gmail.com,Brendan Jurd,direvus@gmail.com,1487486147,1487486147,1cab3009e254e10faf06500846565d72fc2c5402
1cab3009e254e10faf06500846565d72fc2c5402,1cab3009,Miscellaneous minor code cleanups.,"Miscellaneous minor code cleanups.

Use 'int' where 'Integer' is unecessary, use Integer.valueOf instead of
new Integer where it is, remove some unused declarations/imports, and
add some allowable 'final' modifiers.
",,,,Brendan Jurd,direvus@gmail.com,Brendan Jurd,direvus@gmail.com,1487405124,1487405124,869ce8964de3812af73ad9c375fc1504b4ee6404
869ce8964de3812af73ad9c375fc1504b4ee6404,869ce896,Bump to version 2.1.,"Bump to version 2.1.
",,,,Brendan Jurd,direvus@gmail.com,Brendan Jurd,direvus@gmail.com,1487403857,1487403857,5851ee04d54f5ebd716601152f7a79e1c96c1329
5851ee04d54f5ebd716601152f7a79e1c96c1329,5851ee04,Move includes after dice in config description.,"Move includes after dice in config description.

I think this is a more natural pattern for most people -- we are more
likely to say ""d20 plus DEX"" than ""DEX plus d20"".  Static modifiers and
multipliers are still listed at the end.
",,,,Brendan Jurd,direvus@gmail.com,Brendan Jurd,direvus@gmail.com,1487403763,1487403763,77eef8fd0bf471f771b178fe30cea65e2d365591
77eef8fd0bf471f771b178fe30cea65e2d365591,77eef8fd,Replace the add include activity with a Dialog.,"Replace the add include activity with a Dialog.

The single-item selection dialog is a really good fit for this task.
",,,,Brendan Jurd,direvus@gmail.com,Brendan Jurd,direvus@gmail.com,1487403517,1487403613,e29361ae5d4f3570a4b6ecf4f33ea6230d4211b5
e29361ae5d4f3570a4b6ecf4f33ea6230d4211b5,e29361ae,Require confirmation before deleting an included preset.,"Require confirmation before deleting an included preset.

Also, when deleting a preset, go through existing presets and remove any
inclusions that point to the deleted preset.  This will happen in the
fullness of time anyway, as saving and reloading the profiles will
discard any include references that do not point to a valid preset, but
it's better all round to do it immediately.
",,,,Brendan Jurd,direvus@gmail.com,Brendan Jurd,direvus@gmail.com,1487401520,1487401520,478be82278db041bf231d1918b218ea429795ff2
478be82278db041bf231d1918b218ea429795ff2,478be822,Replace name preset activity with Dialog.,"Replace name preset activity with Dialog.

Also, add a success Toast message for update preset actions, to make it
more clear to the user what has happened.
",,,,Brendan Jurd,direvus@gmail.com,Brendan Jurd,direvus@gmail.com,1487399492,1487399559,8ee7fa7e856946bb8bc399e5b6a0aaf248e20fed
8ee7fa7e856946bb8bc399e5b6a0aaf248e20fed,8ee7fa7e,Apply padding to custom dialog content in Name Profile.,"Apply padding to custom dialog content in Name Profile.

Turns out that putting a margin on dialog contents doesn't work, so the
only (sane) way to comply with the design specifications for dialogs is
to put a padding on the inside of the top-level layout for the custom
content.
",,,,Brendan Jurd,direvus@gmail.com,Brendan Jurd,direvus@gmail.com,1487395095,1487395095,896138ac563217aebdbdf6a52c8cfb3fd9147387
896138ac563217aebdbdf6a52c8cfb3fd9147387,896138ac,Make the primary result much more prominent.,"Make the primary result much more prominent.

The most recent result is now shown centered in the right-hand pane, in
a huge text size, and the four results prior to it are shown separately
in a row below from left to right.

The previous layout was not visually obvious enough about displaying the
latest roll result, and the right-to-left ordering of result history was
unintuitive.
",,,,Brendan Jurd,direvus@gmail.com,Brendan Jurd,direvus@gmail.com,1487392023,1487392023,5ac10dc0b3081eb5888d298ca6f76f40c47f6662
5ac10dc0b3081eb5888d298ca6f76f40c47f6662,5ac10dc0,Replace instances of android layout 'fill_parent' with 'match_parent'.,"Replace instances of android layout 'fill_parent' with 'match_parent'.

These have the same functional meaning, but the Android guys changed the
officially blessed name to 'match_parent' in API Level 8, because they
felt that 'fill' gave the wrong impression.
",,,,Brendan Jurd,direvus@gmail.com,Brendan Jurd,direvus@gmail.com,1487390431,1487390431,daef6b764462cf6fcd5e948a8afd9be778388a50
daef6b764462cf6fcd5e948a8afd9be778388a50,daef6b76,Re-implement profile naming activity as a Dialog.,"Re-implement profile naming activity as a Dialog.
",,,,Brendan Jurd,direvus@gmail.com,Brendan Jurd,direvus@gmail.com,1487389932,1487389932,5166b630e2f615900a11f25bad384189f66ac407
5166b630e2f615900a11f25bad384189f66ac407,5166b630,Re-implement delete profile as an AlertDialog.,"Re-implement delete profile as an AlertDialog.

This fits in better with the standard UI than my giant full-screen
activities, but it sure was a pain to write.  The Android Dialog API is
a coder's nightmare of batteries-not-included nonsense.

Despite the ridiculous amount of boilerplate code I had to put in to
conjure up a simple confirmation dialog, this is still a win in terms of
lines of code once I took out the activity class and layout XML for the
old stuff.
",,,,Brendan Jurd,direvus@gmail.com,Brendan Jurd,direvus@gmail.com,1487337860,1487338123,10bb91a6865f395f881c596e6fc223ceb1afd098
10bb91a6865f395f881c596e6fc223ceb1afd098,10bb91a6,Fix coding error in preset inclusion path.,"Fix coding error in preset inclusion path.
",,,,Brendan Jurd,direvus@gmail.com,Brendan Jurd,direvus@gmail.com,1487330075,1487330075,ae301a602d0bb249eb61408cb3dcb5b843b62edc
ae301a602d0bb249eb61408cb3dcb5b843b62edc,ae301a60,Major update to persistent storage model.,"Major update to persistent storage model.

Instead of using an SQLite database, which is patently overkill for the
amount of data this app stores, I am now serialising all of the app data
into a JSON string and storing that string as a SharedPreference.

The JSON string is an array of profile objects, and the 'presets' member
of each profile object is an array of preset objects.

Because this update required me to modify large portions of the code,
I've also taken this opportunity to clean up a lot of Lint issues, fix a
few misbehaviours and take greater care with user input checking.

This commit is a WIP, the use of preset includes does not appear to be
working at the moment.
",,,,Brendan Jurd,direvus@gmail.com,Brendan Jurd,direvus@gmail.com,1487316942,1487316942,04f026a1ef5fcaf43c270d83056d49faf574f947
04f026a1ef5fcaf43c270d83056d49faf574f947,04f026a1,Add promo image for Android store listing.,"Add promo image for Android store listing.

This is the same content as the 'feature' image, just at a different
aspect ratio.
",,,,Brendan Jurd,direvus@gmail.com,Brendan Jurd,direvus@gmail.com,1487050685,1487050685,826ae49494f37f531dcf7972c19e2832ba59f684
826ae49494f37f531dcf7972c19e2832ba59f684,826ae494,"Move ""OK"" buttons to the right-hand side.","Move ""OK"" buttons to the right-hand side.

Per Android UI guidelines, affirmative actions should appear on the
right of a button group.

Also, relabel the reset button as ""Clear"", I believe this is more
intuitive.
",,,,Brendan Jurd,direvus@gmail.com,Brendan Jurd,direvus@gmail.com,1487048028,1487048028,c1373a453fe4cbe6f5b82d512aced4621ddc81d7
c1373a453fe4cbe6f5b82d512aced4621ddc81d7,c1373a45,Replace Objects.equals() with native method calls.,"Replace Objects.equals() with native method calls.

Turns out that using Objects.equals() would require a bump to the
minimum API level support: not worth it.
",,,,Brendan Jurd,direvus@gmail.com,Brendan Jurd,direvus@gmail.com,1487047391,1487047391,a149b911271df29bfdf034755fb1ff27d2604f3f
a149b911271df29bfdf034755fb1ff27d2604f3f,a149b911,Fix inconsistent context menu IDs.,"Fix inconsistent context menu IDs.

Also, edit the 'update preset' label for clarity.
",,,,Brendan Jurd,direvus@gmail.com,Brendan Jurd,direvus@gmail.com,1487047340,1487047340,4cdd555b808df5793f270ea255566d2294d76bc6
4cdd555b808df5793f270ea255566d2294d76bc6,4cdd555b,Add hint and input type to preset/profile name inputs.,"Add hint and input type to preset/profile name inputs.

Per Android Lint.
",,,,Brendan Jurd,direvus@gmail.com,Brendan Jurd,direvus@gmail.com,1487046153,1487046173,d0cd4df4ff5bef8946fbc2672056fe2497a5ab51
d0cd4df4ff5bef8946fbc2672056fe2497a5ab51,d0cd4df4,"Move uses-sdk element before application, per Lint.","Move uses-sdk element before application, per Lint.
",,,,Brendan Jurd,direvus@gmail.com,Brendan Jurd,direvus@gmail.com,1487046130,1487046130,795467af04f5c288273804642e24e2d68c94fc0d
795467af04f5c288273804642e24e2d68c94fc0d,795467af,Replace object comparison '==' with 'equals()'.,"Replace object comparison '==' with 'equals()'.

On recommendation from Android Lint.
",,,,Brendan Jurd,direvus@gmail.com,Brendan Jurd,direvus@gmail.com,1487045702,1487045702,469a8d4a66cf08f41b5c4e97c0e0c98052bdd1ec
469a8d4a66cf08f41b5c4e97c0e0c98052bdd1ec,469a8d4a,"Fix mis-named icon for context menu item ""Include other preset"".","Fix mis-named icon for context menu item ""Include other preset"".
",,,,Brendan Jurd,direvus@gmail.com,Brendan Jurd,direvus@gmail.com,1487045639,1487045639,3ee79f20016666333f1c7751328adb5ada14b991
3ee79f20016666333f1c7751328adb5ada14b991,3ee79f20,Migrate preset context menu into a resource.,"Migrate preset context menu into a resource.
",,,,Brendan Jurd,direvus@gmail.com,Brendan Jurd,direvus@gmail.com,1487045395,1487045395,1742823f003cc65b4509362e959005d0b765a64c
1742823f003cc65b4509362e959005d0b765a64c,1742823f,Ignore all drawable resources in git.,"Ignore all drawable resources in git.
",,,,Brendan Jurd,direvus@gmail.com,Brendan Jurd,direvus@gmail.com,1487043389,1487043389,afecfc91a7f060db07de85911872ed9cdd80ac5d
afecfc91a7f060db07de85911872ed9cdd80ac5d,afecfc91,Replace deprecated android:number with android:inputType.,"Replace deprecated android:number with android:inputType.
",,,,Brendan Jurd,direvus@gmail.com,Brendan Jurd,direvus@gmail.com,1487043364,1487043364,1105f5f23e484bdf9a7b5399bcc23be342bd706b
1105f5f23e484bdf9a7b5399bcc23be342bd706b,1105f5f2,Rename android package to au.id.swords.third2.,"Rename android package to au.id.swords.third2.

In order to release the app under a new developer key, we have to change
the package name.  The old app will remain on the store as
au.id.swords.third, and the new one will appear as au.id.swords.third2.
",,,,Brendan Jurd,direvus@gmail.com,Brendan Jurd,direvus@gmail.com,1487042551,1487042551,0b70689d9e7a69c62e3a8dca683d8e2ba1dca7e5
0b70689d9e7a69c62e3a8dca683d8e2ba1dca7e5,0b70689d,Bump android version to 1.2.,"Bump android version to 1.2.
",,,,Brendan Jurd,direvus@gmail.com,Brendan Jurd,direvus@gmail.com,1486999516,1486999516,8d8d178b4860c5340648d2a74de5397c16e2b5f9
8d8d178b4860c5340648d2a74de5397c16e2b5f9,8d8d178b,Add more whitespace in the android layout.,"Add more whitespace in the android layout.
",,,,Brendan Jurd,direvus@gmail.com,Brendan Jurd,direvus@gmail.com,1486999500,1486999500,dc0a289fcc4ea0fc0df83236b73a16ffafc40b18
