id,short_id,title,message,additions,deletions,total,author_name,author_email,committer_name,committer_email,authored_date,committed_date,parent_ids
dc0a289fcc4ea0fc0df83236b73a16ffafc40b18,dc0a289f,Add more padding between major layout elements.,"Add more padding between major layout elements.

Previously the layout was a bit cramped, needed some whitespace.

Also, add a label to the range display to make it more clear what it is
showing.
",,,,Brendan Jurd,direvus@gmail.com,Brendan Jurd,direvus@gmail.com,1486971309,1486971309,54a6ecebcf935430c23e24572e0089eb60096913
54a6ecebcf935430c23e24572e0089eb60096913,54a6eceb,Populate appcompat App Bar to replace old options menu.,"Populate appcompat App Bar to replace old options menu.
",,,,Brendan Jurd,direvus@gmail.com,Brendan Jurd,direvus@gmail.com,1486969438,1486969438,3b301ac342a67aa7b75522c932a720ea83887a0b
3b301ac342a67aa7b75522c932a720ea83887a0b,3b301ac3,Add dependency on Android Support Library.,"Add dependency on Android Support Library.

This allows us to support a wider range of API levels while still having
a standard-ish Action Bar.

I still need to convert the existing 'menu' into a modern toolbar-based
ActionBar.

The minimum API level is bumped from 3 to 9 (the lowest version
supported by the appcompat library), and the target API level is bumped
to 25.
",,,,Brendan Jurd,direvus@gmail.com,Brendan Jurd,direvus@gmail.com,1486961527,1486961527,3ed04b9abce7275a758db87b2752f5c62d4d79ad
3ed04b9abce7275a758db87b2752f5c62d4d79ad,3ed04b9a,Clean up import statements.,"Clean up import statements.

Remove unused imports and resort existing imports.
",,,,Brendan Jurd,direvus@gmail.com,Brendan Jurd,direvus@gmail.com,1486875349,1486875349,88f31cb04f4d8e87d1e4cfe41f741cfb85d39806
88f31cb04f4d8e87d1e4cfe41f741cfb85d39806,88f31cb0,"Convert build system to Gradle, per Android Studio.","Convert build system to Gradle, per Android Studio.
",,,,Brendan Jurd,direvus@gmail.com,Brendan Jurd,direvus@gmail.com,1486875309,1486875309,8f131559afe00b50493bf7515e8cbb6486ac05f1
8f131559afe00b50493bf7515e8cbb6486ac05f1,8f131559,Add missing dependency of android on images/app_48.png.,"Add missing dependency of android on images/app_48.png.
",,,,Brendan Jurd,direvus@gmail.com,Brendan Jurd,direvus@gmail.com,1486870690,1486870690,2b1289ffcd105be617d5c2d48dc05c6275f4fcfe
2b1289ffcd105be617d5c2d48dc05c6275f4fcfe,2b1289ff,Add SVG-to-PNG images to android files.,"Add SVG-to-PNG images to android files.

This dependency was never actually declared properly in the Makefile, I
just never noticed because the image files were always already there
when I built the android taret.
",,,,Brendan Jurd,direvus@gmail.com,Brendan Jurd,direvus@gmail.com,1486869901,1486869901,fdc23709c32886f35b9b59b24e7ad7004b9d43ea
fdc23709c32886f35b9b59b24e7ad7004b9d43ea,fdc23709,Add recommended build system for Android Studio,"Add recommended build system for Android Studio
",,,,Brendan Jurd,direvus@gmail.com,Brendan Jurd,direvus@gmail.com,1486865789,1486865789,c1f3ca1f2e2b1fafe36aed6bc850bdb98513de90
c1f3ca1f2e2b1fafe36aed6bc850bdb98513de90,c1f3ca1f,Add feature image (required for Google Play).,"Add feature image (required for Google Play).
",,,,Brendan Jurd,direvus@gmail.com,Brendan Jurd,direvus@gmail.com,1430522566,1430522566,949be54a69e1c7d1eb7cc7c016d61f09e5f83cde
949be54a69e1c7d1eb7cc7c016d61f09e5f83cde,949be54a,Inclusions are now working.,"Inclusions are now working.

The user can create a new preset based on existing one, or add an
existing preset to the current one.
",,,,Brendan Jurd,direvus@gmail.com,Brendan Jurd,direvus@gmail.com,1299030083,1299030083,d9089f6bf1185b25990405c07ca1a9ad598dec11
d9089f6bf1185b25990405c07ca1a9ad598dec11,d9089f6b,Allow configs to include other configs.,"Allow configs to include other configs.

At the moment the only way to establish an inclusion is to long-press an
existing preset, and create a new, blank preset using it as an include.
",,,,Brendan Jurd,direvus@gmail.com,Brendan Jurd,direvus@gmail.com,1298856222,1298856222,53ec54e7c5c9d8faa33f22d9b46771121cd32572
53ec54e7c5c9d8faa33f22d9b46771121cd32572,53ec54e7,Merge branch 'master' of ssh://swords.id.au/var/git/third,"Merge branch 'master' of ssh://swords.id.au/var/git/third
",,,,Brendan Jurd,direvus@gmail.com,Brendan Jurd,direvus@gmail.com,1281140361,1281140361,"64d2348a3a8d4a3b98bbb3f15d7008b5cb6d89ef,f3d4375466b24cde44bab80ce26c00803cebd022"
f3d4375466b24cde44bab80ce26c00803cebd022,f3d43754,Add copyright/license notices to the top of sources.,"Add copyright/license notices to the top of sources.
",,,,Brendan Jurd,direvus@gmail.com,Brendan Jurd,direvus@gmail.com,1280797568,1280797568,ed9bd0e380d39ca25e7c13ef70ddcfabfa88e6f9
64d2348a3a8d4a3b98bbb3f15d7008b5cb6d89ef,64d2348a,Fix buggy behavior on screen flip.,"Fix buggy behavior on screen flip.

I found out to my chagrin that when you switch the phone's orientation,
the entire activity gets binned and re-created.  Normally, any view with
an id attribute has its state saved into a Bundle, which is then
restored when the view comes back up.  Unfortunately, this works about
as well as a porcelain cricket bat when multiple view have the same id;
as they do in my counters because I have reused the layout.

The result was that when you flip third into landscape, it not only
looks horrible but it sets ALL of the counters to 1.  Not helpful.

I fixed this by adding a screenOrientation attribute in the manifest, so
the orientation will stay in portrait, but that didn't stop android from
destroying and recreating my activity, so I still had that saved state
problem.

This was fixed by implementing my own onSaveInstanceState() and
onRestoreInstanceState() methods, which take care of saving and
restoring the value of the counters.
",,,,Brendan Jurd,direvus@gmail.com,Brendan Jurd,direvus@gmail.com,1280211407,1280211407,ed9bd0e380d39ca25e7c13ef70ddcfabfa88e6f9
ed9bd0e380d39ca25e7c13ef70ddcfabfa88e6f9,ed9bd0e3,Add rules to build a final signed android package.,"Add rules to build a final signed android package.
",,,,Brendan Jurd,direvus@gmail.com,Brendan Jurd,direvus@gmail.com,1280166852,1280166852,c6e48907ce6e310258f08e1322c1c4c07a1abb2e
c6e48907ce6e310258f08e1322c1c4c07a1abb2e,c6e48907,Apply the Simplified BSD license.,"Apply the Simplified BSD license.
",,,,Brendan Jurd,direvus@gmail.com,Brendan Jurd,direvus@gmail.com,1280163208,1280163208,27506aaf110eadb3f80d69630acee59e814e0802
27506aaf110eadb3f80d69630acee59e814e0802,27506aaf,Prepare the android manifest for final packaging.,"Prepare the android manifest for final packaging.
",,,,Brendan Jurd,direvus@gmail.com,Brendan Jurd,direvus@gmail.com,1280162952,1280162952,172faae8ae3853937fc432055846231f7d41b860
172faae8ae3853937fc432055846231f7d41b860,172faae8,Add the dx.,"Add the dx.

The dx is a special part of the dice configuration which can have any
number of sides the user wishes.  This allows you to roll ""dice"" which
would be impossible to construct as a physical object, like a d3 or d27.

This commit also includes a lot of frobbing of the layout of the
counters to get them to behave on the HTC Hero.  I found that no amount
of pleading with attributes like ""maxWidth"" and ""maxEms"" could get the
counters to be any smaller than about 7 digits wide.  Setting the
layout_width attribute to a constant width did do the trick, however.
",,,,Brendan Jurd,direvus@gmail.com,Brendan Jurd,direvus@gmail.com,1280159732,1280159935,70b4f047884e97def34f9fc0549aabac05cb43e8
70b4f047884e97def34f9fc0549aabac05cb43e8,70b4f047,Refactor the Counter classes to make room for the dx.,"Refactor the Counter classes to make room for the dx.

The Counter base class is now abstract and only knows how to interact
with the EditText of the counter itself; what goes into the left-hand
cell and how the row is laid out is left entirely up to the discretion
of inheriting classes.

The layout and button code has been shifted into a new ButtonCounter
class, which is instantiated directly to produce the multiplier and
modifier buttons.  The DiceButton class is now a subclass of
ButtonCounter.  In this way, the DxCounter will be able to inherit from
Counter with a totally different setup to the other counter types.
",,,,Brendan Jurd,direvus@gmail.com,Brendan Jurd,direvus@gmail.com,1280154143,1280154143,b42d38af2427d343c396df743dfe08ca5758d7be
b42d38af2427d343c396df743dfe08ca5758d7be,b42d38af,Remove unnecessary update calls on Counter button click.,"Remove unnecessary update calls on Counter button click.

The call to modValue() will change the text inside the counter, which
will then trigger the afterTextChanged event, and that will take care of
updating the UI.
",,,,Brendan Jurd,direvus@gmail.com,Brendan Jurd,direvus@gmail.com,1280153285,1280153285,57b4dc3978dd895640f8032863955347164026e9
57b4dc3978dd895640f8032863955347164026e9,57b4dc39,Add the four most recent roll results.,"Add the four most recent roll results.

Each time a roll is performed, the previous results shift one view to
the left.
",,,,Brendan Jurd,direvus@gmail.com,Brendan Jurd,direvus@gmail.com,1280152868,1280152868,f5e8577ca21f859a629d02f0184dd7356211926d
f5e8577ca21f859a629d02f0184dd7356211926d,f5e8577c,Don't include the multiplier if no dice are configured.,"Don't include the multiplier if no dice are configured.

If there are no dice configured, then the multiplier will be mupliplying
by zero, and so there's no point including it in the description.
",,,,Brendan Jurd,direvus@gmail.com,Brendan Jurd,direvus@gmail.com,1280150385,1280150385,043089f532d70171b92fec20b8f8b492738b0590
043089f532d70171b92fec20b8f8b492738b0590,043089f5,Minor layout tweaks to the counter text boxes.,"Minor layout tweaks to the counter text boxes.
",,,,Brendan Jurd,direvus@gmail.com,Brendan Jurd,direvus@gmail.com,1280070924,1280070924,fb6d0ea9ea4936079ea95177e67a1aef5b200b51
fb6d0ea9ea4936079ea95177e67a1aef5b200b51,fb6d0ea9,Add the ability to delete profiles entirely.,"Add the ability to delete profiles entirely.
",,,,Brendan Jurd,direvus@gmail.com,Brendan Jurd,direvus@gmail.com,1280070487,1280070487,373371f807a350880e4291daf2218346fd75373e
373371f807a350880e4291daf2218346fd75373e,373371f8,Add the ability to add new profiles and switch profiles.,"Add the ability to add new profiles and switch profiles.
",,,,Brendan Jurd,direvus@gmail.com,Brendan Jurd,direvus@gmail.com,1280065812,1280065812,49ff322b436c593d7cf354f53a271b520e358430
49ff322b436c593d7cf354f53a271b520e358430,49ff322b,Implement rename/delete of presets.,"Implement rename/delete of presets.

This includes some behind-the-scenes work on how the ThirdActivity
stores its config.  Previously, the config variable was blown away and
rebuilt from the counters any time one of the counters was updated.  In
order to keep track of the last selected preset's id and name, I needed
to make the config persist, and to do that I had to break a nasty loop
condition.

The loop condition was triggered when I set the config.  This would
populate each of the counters with the value from the config, which
would in turn trigger the event to update the config from the counters!
I worked around this by setting a special flag called ConfigImmutable at
the start of updateFromConfig() and unsetting it at the end.  This way
the code knows to blithely ignore any updates *to* the config while it
is busy updating *from* the config.
",,,,Brendan Jurd,direvus@gmail.com,Brendan Jurd,direvus@gmail.com,1280061438,1280061438,f33b96386dc4cfc93ee01f2e700db65c1e40070e
f33b96386dc4cfc93ee01f2e700db65c1e40070e,f33b9638,Add the ability to rename an existing preset.,"Add the ability to rename an existing preset.
",,,,Brendan Jurd,direvus@gmail.com,Brendan Jurd,direvus@gmail.com,1280054370,1280054370,32ff3f9ac478eca0558c1cecc677f3a8cdc4fd9e
32ff3f9ac478eca0558c1cecc677f3a8cdc4fd9e,32ff3f9a,Add a long-click context menu to the preset list.,"Add a long-click context menu to the preset list.
",,,,Brendan Jurd,direvus@gmail.com,Brendan Jurd,direvus@gmail.com,1280052104,1280052104,eaa906442c0a97b70fcc81426da4b6894ecb8d2a
eaa906442c0a97b70fcc81426da4b6894ecb8d2a,eaa90644,Convert to using the 'm' prefix for member varibles.,"Convert to using the 'm' prefix for member varibles.

This is an android coding style convention and while I found it a bit
unpleasant at first, it will be easier going forward if I just don't
fight it.  It also makes for fewer naming collisions with function
arguments, which has got to be a good thing.
",,,,Brendan Jurd,direvus@gmail.com,Brendan Jurd,direvus@gmail.com,1280050996,1280050996,01e45a7540a56a6eb91fabc9d97b15adb16b34f0
01e45a7540a56a6eb91fabc9d97b15adb16b34f0,01e45a75,Add the ability to add new presets.,"Add the ability to add new presets.

This is done by setting up the configuration you would like to save and
then using the ""Add preset"" option from the Menu.

Next on the list is renaming and removing presets, which I expect to
implement as long clicks on the preset itself rather than as menu items.
",,,,Brendan Jurd,direvus@gmail.com,Brendan Jurd,direvus@gmail.com,1280049981,1280049981,21917387bc5e649b002fd3e51d626c3ea3b8e326
21917387bc5e649b002fd3e51d626c3ea3b8e326,21917387,Make sure adb server is running in android-debug build target.,"Make sure adb server is running in android-debug build target.

If the adb server is not running when you call `adb install`, it doesn't
work.  It does automatically start up the server, but it doesn't resume
the install task.  The `adb start-server` command will start up the
server if it isn't running but will harmlessly exit if it is already
running.
",,,,Brendan Jurd,direvus@gmail.com,Brendan Jurd,direvus@gmail.com,1280043366,1280043366,5ad28d63860e6748a2287a6a46cb50a30a9f6a95
5ad28d63860e6748a2287a6a46cb50a30a9f6a95,5ad28d63,Add a sqlite database to store profiles and presets.,"Add a sqlite database to store profiles and presets.

Also add a Spinner widget to select the current profile.

There is no support for adding or modifying profiles and presets as yet.
The sqlite database is initialised with one preset named 'Default' and
that's it.  Creation and modification will probably be via Options Menus
and Context Menus.
",,,,Brendan Jurd,direvus@gmail.com,Brendan Jurd,direvus@gmail.com,1279951839,1279951839,d9443c28797a7a0dc3da7e9d59785ad4b1ccf38b
d9443c28797a7a0dc3da7e9d59785ad4b1ccf38b,d9443c28,Add the ability to load and roll presets by clicking them.,"Add the ability to load and roll presets by clicking them.
",,,,Brendan Jurd,direvus@gmail.com,Brendan Jurd,direvus@gmail.com,1279892427,1279892427,2cfcc83fd52a3f70488a2d0d0835698a8ba8095a
2cfcc83fd52a3f70488a2d0d0835698a8ba8095a,2cfcc83f,Add a 'name' property to ThirdConfig.,"Add a 'name' property to ThirdConfig.

This allows a configuration to be paired with a descriptive label like
'Damage' or some such.  The toString() method was split into toString()
which includes the name, and describeConfig(), which does not.
",,,,Brendan Jurd,direvus@gmail.com,Brendan Jurd,direvus@gmail.com,1279892279,1279892279,2d0752329ff7cf5aab2752f6665699e52923b35f
2d0752329ff7cf5aab2752f6665699e52923b35f,2d075232,Make space for the presets list by flipping out the results log.,"Make space for the presets list by flipping out the results log.

The ViewFlipper is controlled by a pair of radio buttons.
",,,,Brendan Jurd,direvus@gmail.com,Brendan Jurd,direvus@gmail.com,1279871752,1279871752,ae5834e3795dfa42b6a1eee98da1c67dbe31293b
ae5834e3795dfa42b6a1eee98da1c67dbe31293b,ae5834e3,Add progress bar to illustrate where the result falls.,"Add progress bar to illustrate where the result falls.
",,,,Brendan Jurd,direvus@gmail.com,Brendan Jurd,direvus@gmail.com,1279859655,1279859655,4291e4ad622ebc6b2800b9658783c39e8574d0cc
4291e4ad622ebc6b2800b9658783c39e8574d0cc,4291e4ad,"Put the counters into a ScrollView, reinstate the multiplier.","Put the counters into a ScrollView, reinstate the multiplier.

There's only enough vertical room to display 9 of my counter widgets,
and in total we have 11 (8 basic dice, the multiplier, the modifier and
the custom dice).  With a scroll, the less commonly used counters can be
at the bottom off-screen, and the user can swipe to them when needed.
",,,,Brendan Jurd,direvus@gmail.com,Brendan Jurd,direvus@gmail.com,1279858225,1279858225,01848783ce222e49f96775f5bb2471e139b2c785
01848783ce222e49f96775f5bb2471e139b2c785,01848783,Set focus initially on the Roll button.,"Set focus initially on the Roll button.

Without this, the focus is initially set on the edit field for the d2,
and on the HTC Hero this pops up a soft keyboard every time you go into
the app, which is a bit offputting.
",,,,Brendan Jurd,direvus@gmail.com,Brendan Jurd,direvus@gmail.com,1279857937,1279857937,301bed40c4888ad579e2fc4d705383a5caf7b3bc
301bed40c4888ad579e2fc4d705383a5caf7b3bc,301bed40,Add a label to show the possible range of the dice roll.,"Add a label to show the possible range of the dice roll.
",,,,Brendan Jurd,direvus@gmail.com,Brendan Jurd,direvus@gmail.com,1279787363,1279787363,0a3dcc31d98c2454d3b90e9a2aa36eac70dfc91d
0a3dcc31d98c2454d3b90e9a2aa36eac70dfc91d,0a3dcc31,Add a table for logging individual roll results.,"Add a table for logging individual roll results.
",,,,Brendan Jurd,direvus@gmail.com,Brendan Jurd,direvus@gmail.com,1279786291,1279786291,c1c3949d71e9f5b17df14aa060e3362099ddaf53
c1c3949d71e9f5b17df14aa060e3362099ddaf53,c1c3949d,Get rolling working.,"Get rolling working.

This commit allows for the current configuration to be rolled and the
result placed in a simple text label.  It definitely needs tweaking on
the presentation, and I also want to add a log of the individual rolls.
",,,,Brendan Jurd,direvus@gmail.com,Brendan Jurd,direvus@gmail.com,1279782239,1279782239,52d4138b818355589cc42e55d126a05172ecaaa0
52d4138b818355589cc42e55d126a05172ecaaa0,52d4138b,Update description when a counter is edited manually.,"Update description when a counter is edited manually.
",,,,Brendan Jurd,direvus@gmail.com,Brendan Jurd,direvus@gmail.com,1279777702,1279777702,4a3e28314ed52675d8cad534c72274526f09f73b
4a3e28314ed52675d8cad534c72274526f09f73b,4a3e2831,Add the ThirdConfig class.,"Add the ThirdConfig class.

This commit adds support in the android app for populating the interface
from a ThirdConfig, and vice versa.  It also supports a textual
description of the current config in a label at the top right of the
UI.
",,,,Brendan Jurd,direvus@gmail.com,Brendan Jurd,direvus@gmail.com,1279776095,1279776095,30c70c58d390f169013b944b8ea53f3cc7db64ab
30c70c58d390f169013b944b8ea53f3cc7db64ab,30c70c58,Add a config description label and roll/reset buttons to the layout.,"Add a config description label and roll/reset buttons to the layout.

The reset button is fully functional but the label and roll button don't
do anything as yet.
",,,,Brendan Jurd,direvus@gmail.com,Brendan Jurd,direvus@gmail.com,1279767105,1279767105,eac9da59a8a6f0a6b146a534633930c2ed1ebaa6
eac9da59a8a6f0a6b146a534633930c2ed1ebaa6,eac9da59,Add the resetCounters() method.,"Add the resetCounters() method.

This sets all counters to zero when the Reset button is pressed.

I have also added definitions for roll() and describeConfig() but these
are just skeletons at the moment.
",,,,Brendan Jurd,direvus@gmail.com,Brendan Jurd,direvus@gmail.com,1279767058,1279767058,3982a4adac11ebf555d788bfca529fa56cc03319
3982a4adac11ebf555d788bfca529fa56cc03319,3982a4ad,Add rule to ignore .vimrc files.,"Add rule to ignore .vimrc files.
",,,,Brendan Jurd,direvus@gmail.com,Brendan Jurd,direvus@gmail.com,1279766956,1279766956,e8f203e347bf2a53abba5ea606850fda2c89ca09
e8f203e347bf2a53abba5ea606850fda2c89ca09,e8f203e3,Pack the dice counter objects into an array.,"Pack the dice counter objects into an array.
",,,,Brendan Jurd,direvus@gmail.com,Brendan Jurd,direvus@gmail.com,1279702633,1279702633,62649a28adb9fd43ab614f946a34df4813bfd65c
62649a28adb9fd43ab614f946a34df4813bfd65c,62649a28,Implement control of the counters using the buttons.,"Implement control of the counters using the buttons.
",,,,Brendan Jurd,direvus@gmail.com,Brendan Jurd,direvus@gmail.com,1279700472,1279700472,e64ac6bf55ea39665dc17fd5d2a071f72ee5c7a4
e64ac6bf55ea39665dc17fd5d2a071f72ee5c7a4,e64ac6bf,Get the basic layout working with composite widgets.,"Get the basic layout working with composite widgets.

I have used a subclass of TableRow to represent the composite
arrangement of a dice button with its companion counter field.  The idea
is for the button to be capable of controlling the counter; clicking
on the button should advance the counter by one each time.  I haven't
yet built any of the listeners to make this work; this commit just
establishes the layout.
",,,,Brendan Jurd,direvus@gmail.com,Brendan Jurd,direvus@gmail.com,1279698933,1279698933,f918fc78c5efbc382ae4aaf1701e3b60dc6264df
f918fc78c5efbc382ae4aaf1701e3b60dc6264df,f918fc78,Android app now includes the PNG images and has a proper app icon.,"Android app now includes the PNG images and has a proper app icon.
",,,,Brendan Jurd,direvus@gmail.com,Brendan Jurd,direvus@gmail.com,1279584290,1279584290,fce35af77e6d2fe0789f1866c125740c34af2f56
fce35af77e6d2fe0789f1866c125740c34af2f56,fce35af7,Add rules to build and install the android debug package.,"Add rules to build and install the android debug package.
",,,,Brendan Jurd,direvus@gmail.com,Brendan Jurd,direvus@gmail.com,1279584079,1279584079,96ccabf5655a21940c5ae2a3afb3627beabd148e
96ccabf5655a21940c5ae2a3afb3627beabd148e,96ccabf5,Ignore the .directory files created by Konqueror for thumbnails.,"Ignore the .directory files created by Konqueror for thumbnails.
",,,,Brendan Jurd,direvus@gmail.com,Brendan Jurd,direvus@gmail.com,1279584044,1279584044,7f2eb58355f52c6efb9fbfa6eeb2f63bcdb7d6db
7f2eb58355f52c6efb9fbfa6eeb2f63bcdb7d6db,7f2eb583,Add rules to build a 48px version of the app icon.,"Add rules to build a 48px version of the app icon.
",,,,Brendan Jurd,direvus@gmail.com,Brendan Jurd,direvus@gmail.com,1279584002,1279584002,1c4ba711289a64f6d843fd1181b46983c2975ebe
1c4ba711289a64f6d843fd1181b46983c2975ebe,1c4ba711,Add a new third Android project.,"Add a new third Android project.

At this stage the project is just a 'Hello, world' proof of concept app.
",,,,Brendan Jurd,direvus@gmail.com,Brendan Jurd,direvus@gmail.com,1279575618,1279575618,5bd1de64c45750caed6dc399e07b8c9928c58a75
5bd1de64c45750caed6dc399e07b8c9928c58a75,5bd1de64,Remove the pov-ray images and the rules to build them.,"Remove the pov-ray images and the rules to build them.

The pov-ray images are no longer used in the application, so get them
out of the way.
",,,,Brendan Jurd,direvus@gmail.com,Brendan Jurd,direvus@gmail.com,1279541871,1279541871,94e9f42c1d2f64b4f0e7076780e4a2d0184f2ab3
94e9f42c1d2f64b4f0e7076780e4a2d0184f2ab3,94e9f42c,Refine Windows (un)installation instructions.,"Refine Windows (un)installation instructions.

The windows installer is now working, so I have updated the README with
the new installation instructions.
",,,,Brendan Jurd,direvus@gmail.com,Brendan Jurd,direvus@gmail.com,1279541652,1279541652,bee087094ba477023e95e16ac81c0425ac5c3dae
bee087094ba477023e95e16ac81c0425ac5c3dae,bee08709,Redirect stderr to a logfile in the user's app directory.,"Redirect stderr to a logfile in the user's app directory.

The original motivation was that py2exe's version of the app would try
to drop stderr messages out to third.exe.log in the program directory,
which was fine on winxp but failed due to permissions issues on win7.
Rather than bugger around trying to solve the permissions issues, I just
had the messages go to the user's private third directory, and having
done so I felt that this would be a reasonable arrangement for linux
too.
",,,,Brendan Jurd,direvus@gmail.com,Brendan Jurd,direvus@gmail.com,1279535942,1279535942,8df9f32b7ac7bfa82782708a604825fc49e15d6c
8df9f32b7ac7bfa82782708a604825fc49e15d6c,8df9f32b,Tweak py2exe options.,"Tweak py2exe options.

After much trial-and-error I seem to have stumbled upon the combination
of options which will actually create a third which can run on a clean
Windows machine.

The trickiest one was finding that I needed to deliberately exclude
DNSAPI.dll.  This file is included by py2exe's dependency detector, but
the symbols don't necessarily match on the destination machine.
",,,,Brendan Jurd,direvus@gmail.com,Brendan Jurd,direvus@gmail.com,1279535782,1279535782,af31ad97636451696c062b2a8a5bf41e8ebd8125
af31ad97636451696c062b2a8a5bf41e8ebd8125,af31ad97,Explicitly copy intl.dll from the GTK binaries.,"Explicitly copy intl.dll from the GTK binaries.

This dependency is somehow not detected by py2exe, but it is required on
the destination machine.  Including it manually seems to be the way to
work around this.
",,,,Brendan Jurd,direvus@gmail.com,Brendan Jurd,direvus@gmail.com,1279535676,1279535676,7e2293af557a9152e0fabc89c833f9fa8f65a9d5
7e2293af557a9152e0fabc89c833f9fa8f65a9d5,7e2293af,Add new variable for win32 build dependencies.,"Add new variable for win32 build dependencies.
",,,,Brendan Jurd,direvus@gmail.com,Brendan Jurd,direvus@gmail.com,1279535645,1279535645,fe835cc3e55febf205d1e30a32daf460f3191e57
fe835cc3e55febf205d1e30a32daf460f3191e57,fe835cc3,Add the Visual C redistributable to the win32 installer.,"Add the Visual C redistributable to the win32 installer.

This will cause the Visual C installer to start up after the third
installer has completed.  It's not an awesome solution but unfortunately
it seems to be the only way to go.
",,,,Brendan Jurd,direvus@gmail.com,Brendan Jurd,direvus@gmail.com,1279301065,1279301065,62e64772dd182aae356ad5a46be476f83a7a7b4c
62e64772dd182aae356ad5a46be476f83a7a7b4c,62e64772,Add a build system for the win32 port.,"Add a build system for the win32 port.

This build system is unwieldly to say the least, so I have documented
the process in a new README file.
",,,,Brendan Jurd,direvus@gmail.com,Brendan Jurd,direvus@gmail.com,1279229730,1279229730,dcb6126154b53e72a110eac01725ab216e6dfd71
